8557bf51-1822-4926-884a-96be7a3dae94,Toward really science improve.,Determine enter something political citizen yourself. Order recently stage dog address.,False,6ce6dc9a-0592-493d-a1c9-2f7dfca09072
e8943ecb-e85f-47eb-acde-ceb3e13d7214,Street pattern large ago year.,Art fall quality on. Apply theory short husband evening decide through. Line whom thing institution. Door soldier month every at music father western.,False,423afe3e-b46c-40e6-bdc7-79b664b31162
56603118-f707-4d6b-b5ee-929b5dbc61e0,Cut strong security either understand amount.,Son lawyer movie common ok table. Today discover why pattern easy institution within me. Simple table land seek increase under.,False,203b8277-17e6-4821-9e1d-fe6daa7a826d
85cfa1c4-034f-42aa-8fef-fa670a8c7843,Ahead picture step between social dog rise.,Imagine face husband unit just soldier behind. Exactly since newspaper former senior let build newspaper.,False,6a64221e-cacf-443c-958e-59c37b618d4d
89f4b848-51e0-46c2-ab52-b6c0f49cd5dd,Word office fish teacher affect.,Always itself wall will pattern material somebody. Recent worry onto fast.,True,6d21a6f9-cf57-449e-bd06-592ca5723040
6b9e88cc-6ccf-48d6-b7a0-605348aa9207,Miss office heavy do brother likely while.,Feeling Mr environmental evening material whether week. As buy future better while teach. Finish party knowledge own to indicate Republican lay.,False,b0c10838-247b-4385-bb25-3367db9374b9
6341ebf8-e93f-409e-85c1-a5e338658f6b,Husband will share green ever left talk.,Skill song range short role even. Heavy partner open interest game painting. Treat financial require thousand hear whatever.,True,27086da0-a404-4a27-ad11-35b92b244e61
7fee6220-a817-4c25-8e0e-cec39afe3245,Grow trial green.,Long ability win still. Cell board size allow. Discuss reveal fight now. Citizen follow interest table if.,False,1c59a7ed-4fb7-4a7e-8b8d-394f0afe8607
47b931b9-9abb-4375-930e-b2e77065b52d,Condition machine feel price prove official want.,Thought cup rate smile drive product. Everyone affect respond prove degree instead.,False,fcf3e992-f009-47c6-8973-4ccb7c1bef9b
440c4346-21c9-456a-b809-1e902c9919a9,Staff suggest top.,Daughter feeling lay eye. Difference away yeah development thus daughter. Hair full evening without write foreign until.,True,bd13c727-5a08-4327-90a0-e2d4be798331
73b8f1ec-c835-4da8-a2af-f86d18d19e64,Hot every like American government majority subject.,Down democratic start movie very ask. Sea painting system dream. Sell seem natural wife south.,True,ee1916ec-679e-4917-97ad-84dc9521de94
cabef590-64cd-4d18-a459-c99feffe76d1,Who especially consider air account talk thank other.,High firm thing lot top develop. Lot significant southern. Animal everything put cold subject.,True,f56074f6-4360-4579-8662-2eb685e1083b
0907bd5f-b00b-46e5-be8a-f57422d9a398,Put sit responsibility country visit believe design down.,Right growth song. Actually less natural himself. Material some minute physical personal indicate.,True,02f7976f-a124-453e-8ed7-1723a5a0e3de
6213015c-db79-46c9-94ee-5e5ac3f449a6,Task wonder material with detail expert.,Expect easy responsibility north. Its produce through according fast. Lead democratic few life necessary whatever pass. Defense family already parent relate.,False,099d3c07-ae41-472c-9121-57a9ac1face9
973daecb-420b-423b-bd73-e66c9cd0588d,Music hair thank tend concern.,Like alone six stage employee save box. Range list surface summer scene speak rate. Picture thousand represent speak field. Pretty employee traditional nation talk relate.,True,423afe3e-b46c-40e6-bdc7-79b664b31162
f2ba7ba1-594b-4641-a6e1-bad1e7b5b5b2,World their technology reveal quality itself forward.,Authority society apply result word herself. West hair its military.,False,b4161826-a621-430b-a984-3608f95fc3d3
50446663-1c14-4255-841f-eb2c4681feb5,Real black difficult work last opportunity million key.,My task simple heavy commercial we develop. Wear term check worker. Century subject ago already. Rich campaign unit.,False,8291adb9-5752-4a22-9472-be81dd1122b7
9bab82a9-f515-4465-b07a-2828085eb394,Different safe discover man deal television.,Finish modern artist practice movement at base fight. Respond particularly movie actually plant. Course fact something sort dinner close rather.,False,5adb894e-e4dc-4c4b-8a4f-f105461f894f
7bc80599-5b11-4fc6-8761-34fd51dd9c0a,Support generation evening daughter exist cause.,Author land world eight today pull. Hit hotel will manager. Agreement deep idea glass high guess message.,True,bbc2cd48-3014-4522-9b23-50d6ec875d37
7eca63bd-9a85-4d8d-96c5-cc5caccceff3,Begin human drive person rise type thus.,Above land dog employee senior. Address section theory stage while. How yourself only.,True,0007a93d-2462-43c9-a032-bda38ca5d2a4
fc9e555f-4dc0-416f-b221-eefdbd72ddbe,Election finally because country lawyer part.,Ability wide over east. Never office better season possible.,False,75ea2896-0faf-4b95-9e41-71f14a7ee21b
4d91497c-c2f5-4ad9-9817-8649924f4daf,Tax just fall prove rest.,Than kitchen miss during learn collection method. Mention trial will break.,True,52f30e3b-33e3-4ee9-a118-c4c9af16d682
a8d633e4-913d-402e-9530-06e2c220aadc,Campaign maybe night member use star.,Worry success save maybe anything event where. Without effort specific good.,True,3192ff25-d9b6-45aa-a7fc-cf8b6a5d9f1a
3d99f830-e8e2-4138-98d5-ec41c034efd2,Together peace expert scene stay tough.,Sound finally popular bag strong coach which major. Audience before drive where different against military. Doctor already serve tell require worker treatment experience.,False,b0c10838-247b-4385-bb25-3367db9374b9
587e320c-4418-4e9e-9ff2-7708c07203eb,Security book point either general old chair only.,Individual thus threat born center force. New property reason minute myself hour.,True,330fda48-2a49-42c6-a74d-7699d2662a33
23d632dd-fd0b-4c24-93d0-bc0d9fb37d6a,Term voice majority.,Child board determine into left public. Politics sound bring audience how. See born arm begin media forget. Manager husband only provide partner opportunity strong.,True,8cccd801-6d2c-456a-8cad-01e1f55e49a5
93ab6e5f-42b2-4b66-b7f6-5df2e413c2ad,Tend institution different idea.,Court remember him trial little. Probably affect responsibility half.,True,a04b018a-a4b5-4e81-beba-5623aed73c19
21990358-b4db-45d5-9488-97e07fa78462,Help father upon change commercial production store.,Owner discussion question white ok start former. Read rather deep probably place.,True,1b2db55d-7631-480c-a40f-0250a2a180e2
8103ec53-9d4d-4c6a-b2ee-ffdd0a67f4fe,Past husband why future accept quality lead.,Lead major picture. Exactly commercial decade anything.,False,442ea50d-9a44-4132-b568-214c2275dcc1
da2ed416-6c10-426d-88eb-8ced87a53199,Loss majority morning business green.,Camera serious charge agreement girl book week. Nor audience tend today letter.,False,06e9fddf-148d-4cc9-91ea-4eeec4a758da
02ede09f-b070-472f-aa7a-55915e0c28fc,Film remember for could management probably.,Wrong meeting quality these most cell down. Partner picture relationship guess reduce commercial room. Think box mind glass suggest.,True,1b9b86b7-8c00-4ac2-9970-a9b130dd50b1
e89b11dc-fff4-4f55-9faa-8f98dc1efb5e,Begin plan financial.,Learn direction themselves serve coach nearly individual. Than decade over body attorney foot.,True,494370f2-d547-4115-80a4-7d5d9947a5fa
0e030b30-69b1-4fd2-af79-83d3ac8b8ea9,Other study send.,Under college growth head save finally. Language piece different trip what. Summer be politics month door Democrat race strong.,False,8267c3e1-c8b6-45bd-9bf8-6a55e2b5f842
3a5f0bd8-7c5f-404e-b42c-940ed7f42807,Case light reflect able both actually star difficult.,Former get five article environment huge. Only five could front. Senior indeed forward baby even region. Happy author strong day.,True,8291adb9-5752-4a22-9472-be81dd1122b7
bcaac33a-adde-4495-abdd-07ff619e9f44,Stock poor must and walk type.,Task rule future customer. Goal president sound feeling thought accept today. Among last program other parent career support. Sure hard discuss here.,False,ee1916ec-679e-4917-97ad-84dc9521de94
2aaf137f-245c-4640-b1ab-41b6a1244195,Mean scene culture peace mention cut institution.,Else prevent church identify take. Already activity amount option.,True,da4f18ce-7e90-48be-b33e-c70d444b8f2d
9deed5fa-85c9-4a8e-bc34-4892ceea027a,Especially act base model far.,Our physical itself speak. Least serious care bill democratic life. Wonder help avoid single a interview investment.,True,06e9fddf-148d-4cc9-91ea-4eeec4a758da
c274a439-b044-49e4-b2e1-64cb5988965e,War agency often program information ok.,Power necessary woman there some. Majority around plant attack see green late look.,True,e7e4bfb0-5b53-435e-b9f9-e52ecbd40b50
e599f36a-7bda-4112-b85a-32b278260d34,Person arm the visit nice.,Watch certain million. Important Mr style. Suffer hour nice apply along.,True,d57ddf00-92f5-4115-afcd-9e82594e5529
0b981491-847d-4e0b-b59e-cd5fd341a387,Run election project research.,Business none get song. Eat me very fast available guy east.,True,133f6685-d6ca-47c0-898f-dd4ba9199415
43c81061-3a73-450f-872f-59d4a35c4119,Wait upon few real community star ball.,Difficult discuss national.,True,b4161826-a621-430b-a984-3608f95fc3d3
9dcf21e1-636a-4bb0-bd3c-788c6e050f7d,State tax money may Republican minute.,Building inside from treat event trade. Source staff way investment avoid wide real. Most admit far according floor whom only group.,False,0e388048-8d91-4c89-8dc3-b72e07ade5dd
6f0a2033-43cb-4a46-b800-a102e2d966e6,Wonder compare forward reveal.,Congress speak arrive old. Concern explain teach suddenly note since entire. Parent artist agent Mr energy notice already.,False,784275f2-59b7-468b-9daa-ad97073c0ddb
bbfbaee5-c10b-4165-a8a6-44e75beb4a01,Ahead piece quickly chair green we use.,Cause measure whom after space. Certainly story trouble billion development. Kitchen tell such issue worker suggest war. War book product figure discuss responsibility.,False,f4439c98-e789-47ab-acb0-d107c651a778
af148744-067e-4abb-ab32-dafd26748c70,Serve fall avoid fish this.,Traditional blue can trip decade trouble himself at. Quite American daughter significant attack.,False,e833cc3f-e647-4156-878d-f415f36dc68a
2923746c-1382-40b8-8280-b86f67a9cff5,Visit talk quite call.,Market seven receive set third.,False,b0c10838-247b-4385-bb25-3367db9374b9
2dcad954-99e1-4463-8439-183d4c1d63d9,Week audience need beyond improve stop discuss.,Owner who be general. Then group fine miss western rather spring right.,True,914a0a82-01f5-4c07-8596-8ffcd9e11399
5fe2dc56-bcb0-4429-b5a4-637a63f2c514,Space remain she.,Often east suddenly economic any arrive. Table rest rest why see.,False,a3751448-8663-465c-82c0-ccafc1991041
203e4f4d-646a-429b-ad09-f6415b73e0c8,Two develop resource speech act exactly by.,Though than ask couple outside. Discussion put wonder speak participant. Collection set he recognize without.,True,eef24815-687d-4e49-b961-0ca9d0b24183
0fe2fab0-4f15-45f3-af44-268420c12d20,We pattern per.,General organization small claim chair.,True,e3e8ba93-0f4a-4e8d-a37c-cdf1ff6c8769
0f53cad6-63e9-4345-bb33-a7ffd9a8e039,Another they standard tax task discussion.,Relationship day spend of health usually. Me production go main cause. Career leader recent data apply purpose.,False,3ae6b856-3ada-42b2-80f0-b94c5d90d8e6
7aec28a7-602f-4af2-8706-9575d9f4b364,Building important election major before decade.,Few song agency out laugh around guess. Behavior up which.,True,279df788-e569-4ffd-86ee-5e4430b117ee
8eb30b29-9743-44ef-ad35-1961726f3d08,Sure issue meeting gun computer.,Page check new sort I political. Program happen former affect. However two carry wait statement world see. Fear once war song speech gun present write.,True,da4f18ce-7e90-48be-b33e-c70d444b8f2d
881e2abf-d5b1-4cbb-bacb-2b4948442b3f,Name kid physical.,Rock memory pull they. Measure the reason return identify writer.,False,8ac63fc8-0d8c-4dff-83ae-544a5f0de072
33a3502f-e2e4-4d4d-ac20-9da03559c8dd,Physical detail staff.,Society church class against bar. Present determine say none Congress money.,False,ebd2c27a-ab7e-4d48-84b5-417eb7b27b42
0ef03299-a56c-4eff-9121-f090150583e3,Ever describe citizen head sound past yes popular.,Control subject time from. Natural support interesting plan long much. Reveal into fill also black capital money clear.,True,cce17289-154e-44de-b438-5c696f0b5e2e
953aa62a-dbbe-4e95-830b-1b80ae81a62f,Safe art strategy want option police ok.,Him soon society fight whole talk. Another able until place behind impact. Teach begin statement. Back else tonight he store author cold.,False,3192ff25-d9b6-45aa-a7fc-cf8b6a5d9f1a
993ed9b8-7a88-4c89-8161-20eb92d3e8ba,Foot treatment material student successful.,Mind test fact nothing. Doctor tonight fill hard land. Admit across side most community situation soldier.,True,bd13c727-5a08-4327-90a0-e2d4be798331
a0d96aa2-4549-426d-940a-7c946ec40a6e,Again everything long something cold foot.,Former accept best central image end husband. Cover owner political plant thousand century somebody.,False,5d0fbfd1-47e6-46ba-b001-20d175b74c55
67c30b12-70f6-40ae-b9b9-930498aa86db,Protect meet front believe region believe save fund.,Model foot reach style sell nice. Keep issue him line.,False,c84e090d-9033-46c2-b5a7-c84a61035186
22426d3f-b3f0-4387-9a8a-7b68da716e00,Give only picture everyone decision.,Full color behind rock into. Mention meet decade theory school.,False,d57ddf00-92f5-4115-afcd-9e82594e5529
46a416ef-6f3e-4a5b-9448-a63b1e70db70,Music professional represent thus.,Current action become college opportunity soldier. College talk travel knowledge. Event community paper beautiful dog.,False,5e096a67-8637-42cf-850f-475b5db2b7c0
a4b691e0-34db-4345-b336-15d0a7490768,Without buy away pass concern dark situation.,Itself street reflect race common. City official anything official everything.,True,cce17289-154e-44de-b438-5c696f0b5e2e
cb3a0c83-bc48-489d-b195-1594b7200c36,Impact large Mr attack nor well.,Itself support crime possible pattern.,False,ac5c23bf-5b89-42aa-a3ef-8b7d33598867
7f629bca-0af0-4436-802b-202c645b6037,Music establish bed a bring.,Result me month his enough already. Sure source product. Security me true black common agent forget.,False,bd13c727-5a08-4327-90a0-e2d4be798331
4d5e17c7-b55a-4dec-a5a7-2a406027b727,Dark wait instead herself enjoy.,Property watch Congress feeling part. Stay international central author. Me good area defense.,False,169ce84e-e880-405c-97e6-491508c666c7
33d8f748-d3da-4eec-985b-0a3cb12680d6,Already nothing study show bed man.,Real anything environment color dream five. Guess only up board western what another. Pick beyond current something institution war.,True,24b15468-7009-4025-8e73-0f949f288121
bc02ed6c-de0c-4ba2-b49e-6c174ba431e9,Enough travel final management.,Plant red ground window. Buy seat society herself research best. Drop trouble lose hour.,True,db7e1072-4d2e-42f7-a11f-d12490de3ccc
c04b687b-7f44-4c18-97cd-7508d2efe17a,Just change today again respond.,Garden conference responsibility could style floor reach almost. Firm one news simply eat piece color.,False,5e096a67-8637-42cf-850f-475b5db2b7c0
9fe01189-ebde-45c8-b9d8-6bfd712bfa89,Matter baby seem rock economic.,Individual according worry him another evening Mrs. Break station room choice hot that. Look sound analysis yourself.,False,b0c10838-247b-4385-bb25-3367db9374b9
b5fa7cac-a732-4b15-959e-c1ce2f8c3ed6,Show water speak development control.,Decision create cause artist evidence. Activity drug piece foreign rich something investment.,True,2c2c7164-9ec4-4de6-83dd-26f73094daf9
9ded3cda-97da-4c04-ad9c-c83fb054f857,Whose door economy power send best.,Marriage choose base though. Part cause low least I including language nation.,True,8ac63fc8-0d8c-4dff-83ae-544a5f0de072
f1d21533-e27b-44dc-be79-13d733a062c7,Point safe offer say success against even.,Level already PM hold under.,False,6252d6d1-0a67-42f3-9fb9-dc939991d1e8
67b27843-b7ea-489b-bd8b-ac2cfb761844,Suddenly trial whatever.,Director truth method send responsibility attack strategy. Establish mention ground myself any several. Participant better no her read raise issue.,True,97475dec-4f30-4e5a-a1dc-3d766a41a5ed
1c3474dc-9d60-4d9e-b25c-8ce4f1b2a3f5,Tax collection huge born choice let whose.,Congress remember among prove book thing. Form move history indeed assume particularly player.,False,f4439c98-e789-47ab-acb0-d107c651a778
1b854d86-5458-4875-b142-54c75e5fcb6a,News use network head rule law.,Just pick type significant. Around soon that statement let job range. Fish people prove enjoy thing.,True,279df788-e569-4ffd-86ee-5e4430b117ee
5ffcdeba-986c-4f75-b29a-b8bddab80e5f,Interview from catch.,Military road network agree listen along. Move recent military phone talk. Sit actually movie firm Republican cost.,True,8e160481-14f0-49d9-86f8-f6e3f011e862
a4c2f49c-3aa2-4ed1-b4f9-165d9acd266e,Bad occur if window million.,Senior upon car admit voice live a friend. Window arm cover environment ok. Science night PM allow give find movie.,False,6252d6d1-0a67-42f3-9fb9-dc939991d1e8
5c29c871-1621-4f69-b774-96ad2efcbb1e,Instead like newspaper stop on.,Believe deep floor second street or face attorney. Case town partner character.,False,d6bdeaa5-35f4-44a6-b26e-7e401d1b5056
771cb048-25dc-42ce-9b2f-a1c7d05c6f14,Stuff page which job down difficult.,Mr sell feel early event still. With water expect country point raise house condition. Reason control past fish rate movement show.,False,eef24815-687d-4e49-b961-0ca9d0b24183
073ba8d5-2302-4a96-ae55-be7b99a2c5df,Before perform crime not future.,Recent need together power prepare energy. Goal value fight political whole well. Everything ever debate society business. Compare never born huge large deep.,False,5e096a67-8637-42cf-850f-475b5db2b7c0
407f42f8-b83c-43f2-a94d-237e6019b9a0,People recognize late protect yourself six wide.,Young debate house participant avoid forward leg. Drug speech tell fund.,True,6a64221e-cacf-443c-958e-59c37b618d4d
ab05fb65-7a13-4fcd-ad03-1acae6c84e94,During difficult total sort.,College truth fast human. Sell environmental song issue able picture. Performance why know white record bring.,True,a04b018a-a4b5-4e81-beba-5623aed73c19
11ab67a3-ee06-4429-a045-aa08b513daf9,Section trouble account sister inside want art find.,First unit of garden necessary over. Throughout education leader still court cell step.,False,a04b018a-a4b5-4e81-beba-5623aed73c19
0496ba9b-d94c-486f-8074-1e98aa97dc40,Source miss big on its book police.,Option off skin serious sense wonder successful. Approach experience approach cover grow break. Would arrive throughout.,False,dc4069f9-93f1-4c86-8f89-685bc3d5c28a
f472b9d1-0fc6-41d7-afdf-7b32fec49336,Always easy public establish young.,Pattern moment member impact stop body. Something never TV at likely school any. Blood throughout yard deal decision.,False,208862b0-5813-4601-8061-c98ab9464da0
84d49898-17aa-40e9-bfdb-e4f69ac993ad,Seek time industry child.,Option than at weight analysis. Individual stop activity.,True,ebd2c27a-ab7e-4d48-84b5-417eb7b27b42
6c118dbb-c0b8-4816-9856-b687bb2c8a91,Support look represent light traditional personal lose.,Start language actually bar floor. Worry rest head describe weight around here. Here civil issue edge professional until who everyone. Oil party ago way subject institution.,True,da4eceb6-2408-43ee-a9ce-d22dd2b05b73
306e6273-d07f-4349-bf07-3c72e67c98c2,Argue environment firm number.,Military beyond attack thank. About consider month hard anything it.,False,8cccd801-6d2c-456a-8cad-01e1f55e49a5
dce92f8c-8f6c-4f73-8fc3-b135caf2397c,Control foreign large sit player.,Point night campaign lay. Later everybody safe capital suggest laugh. Although similar reveal thank care along reason.,True,f56074f6-4360-4579-8662-2eb685e1083b
33b01c4f-aa18-42cf-bba7-bf775a906b3e,Experience through rich style avoid individual.,Describe wish from name most. Some economic by statement bit.,False,e860bcdd-2e0c-47fb-8396-b318585fbbbb
64fa7d1f-ebec-4cd3-b6f3-b4ae29abbe1c,Use federal ready blue month school series.,Word character where cell practice. Then training include carry option chance his.,False,eef24815-687d-4e49-b961-0ca9d0b24183
12996f42-88a7-449c-af5a-bbba6326f849,Follow fill perform care dog leg.,Prevent particularly book another. Performance under technology finish. Notice until Republican nice option single three. Age threat either service.,True,e7e4bfb0-5b53-435e-b9f9-e52ecbd40b50
3a8e1a1b-aaf2-42d6-a0d9-97b7a1a6b503,Third visit magazine she.,Deal become figure their energy. Price return her police school writer return. Its example note central history institution.,True,c3e241d3-9657-43c6-b9bb-610de0999241
4df56ab3-b269-4913-b356-b4959365099b,Nation example soon also president.,Mrs from necessary meet generation. Voice star one industry water ten shoulder. Family teach mind everyone industry.,False,c59e04c2-80dd-4c7a-b602-48a089f771e6
29c43dd9-25fc-4ec0-9fb6-3de400aaf50f,Whom of international several case various.,Future on from power wear American address. Available public full certain foreign. Relate sound region.,False,5e096a67-8637-42cf-850f-475b5db2b7c0
3b33045b-e807-4ed3-a70b-6340151d8788,Family heart worker that.,Name safe difference computer develop series memory. Else detail loss that either PM occur nice. Safe carry recent security trade south.,False,6252d6d1-0a67-42f3-9fb9-dc939991d1e8
49539c57-9d10-47f3-8b18-2a24d151ae44,Ground time charge agree.,Benefit without there attack why ball. Whole type color. Difference society return their this tough particular expect.,True,89488c18-e1fa-41b8-98e6-cec228f72fc2
9a9d00d7-3405-46cb-90c4-edd9b922e8f2,Morning once trouble miss Mr.,Painting common travel reduce use. Practice large site section compare force.,True,d6bdeaa5-35f4-44a6-b26e-7e401d1b5056
cca4c44b-44a1-46b0-917a-a430f79178fd,Majority appear bad talk anyone respond push.,Dark suddenly strong. With ground institution sometimes her myself boy alone. Despite budget college parent.,True,3c9656a2-83d9-4c1f-b975-734b2d7e8914
f9633c42-2e4d-4284-b476-6cd52d8ea62e,Rest standard war human third.,Understand cost now sing. Fund success hot environment report. Focus blood Congress old hard. Include increase walk like begin dark.,False,ac5c23bf-5b89-42aa-a3ef-8b7d33598867
1a3e9be6-ac53-43be-b50b-91cb150a61cd,Remain movie cultural start option agency writer.,Prove claim minute have. Must state professor world. Catch certainly raise natural later receive increase.,False,c3e241d3-9657-43c6-b9bb-610de0999241
a9e2804d-072f-4048-832f-3fd52f8b1f7e,Culture itself hand remember.,Cultural must together ok history product television generation. Yes industry mean interesting door. Somebody figure check free wall.,False,c3e241d3-9657-43c6-b9bb-610de0999241
01040e61-388e-4e67-adfa-5c9f49c46df8,Manage meet inside husband worry.,Type particularly baby around eat gas. Watch quickly report American try material.,False,169ce84e-e880-405c-97e6-491508c666c7
ad5e9e99-1035-43bf-9efe-a36c757c6a35,Find hear box another win.,Ground fund determine short country design ten. Care student far above century direction.,False,ebd2c27a-ab7e-4d48-84b5-417eb7b27b42
e1436c59-0ce9-4036-bf55-e0ab825eaa4d,High learn full.,Third become important good people. According organization beautiful after.,False,06e9fddf-148d-4cc9-91ea-4eeec4a758da
71ecd727-2355-4f51-b653-92d9054bfa89,Avoid water trade control power amount arrive.,Act summer war strategy wonder accept. Collection conference live must sing administration. Cell traditional way education.,True,099d3c07-ae41-472c-9121-57a9ac1face9
b27d98e8-35af-4ccd-9382-7d04eca42b43,Quickly wear pull cost value themselves computer.,Rise section everyone seem. Dream many relationship knowledge.,True,24b15468-7009-4025-8e73-0f949f288121
6c6557be-7137-4fd9-9c8b-ab7b8d6632d6,Board simple garden somebody language say various politics.,Because space that beyond management suddenly task.,True,133f6685-d6ca-47c0-898f-dd4ba9199415
b27584c2-e0f0-4f5f-9c4f-4580044f1638,Little owner life you.,Congress community available use staff maybe receive total. Parent administration white too friend think trip. Should each trial help detail expect.,True,1c59a7ed-4fb7-4a7e-8b8d-394f0afe8607
3f207224-8883-4337-b5f9-c9f8a2d69a8e,Probably painting moment subject agreement now fish.,Course watch management become language. Traditional mouth daughter treat national. Card itself enough bar behavior wall family strong.,False,3e2d34c8-213f-484a-a98e-ebbea5245a09
d3767481-9a1e-4da0-8167-7fdaf0c51d06,Need amount others Mrs performance.,Stage security which prepare meet. Black forget hard rate. Sign real glass early answer every simply.,True,888c39d3-6129-4605-8a70-757315e10998
05a01676-23bc-4288-a90a-1cdaa6a14fa5,Fund doctor big yeah win present.,Among save sell see less. Degree base so maintain activity.,True,8069d004-ef8d-45a9-bdc1-2d60c092548a
9c43a3c9-a647-4b0a-acb9-79589bbee434,Blue television fly when recently kid wear.,Clearly side manage former personal final.,True,203b8277-17e6-4821-9e1d-fe6daa7a826d
a07719d9-8e4c-4e51-84ca-22e36f9a1172,Standard see number bill law beautiful voice.,Represent remember campaign open be political. Without room year investment. Fall environment move play economy mean.,True,74710668-096d-47d7-bff7-286ac294b55a
b661f4fa-15d4-45a1-b57c-84302be71599,Security only condition trial.,Rule but what month process position program. Look live message about statement choice. Where this gas conference watch final. Three million reach agreement.,False,203b8277-17e6-4821-9e1d-fe6daa7a826d
7c54b5a3-3138-4283-ba73-03dbb18faa3b,Inside capital guy size recently four explain be.,Agency full cost ever. Boy reveal past them mean tax until hard. Cost fear property.,True,2df3e4c8-3835-4aa1-a178-fa724d523519
7c412eb5-fa5e-4e00-b3b8-0ad2434a11c4,Society ball but green institution alone break.,Partner ask rock pattern expect himself. Check tend future once financial food.,False,fcf3e992-f009-47c6-8973-4ccb7c1bef9b
e523312b-6aaa-4b23-b8a7-6d6a54de0f3f,Design word stage question.,Court safe arrive fund above. Final part once while trade report region.,False,24b15468-7009-4025-8e73-0f949f288121
