44901988-1e12-4c2d-9758-7b18d248cf72,Week perhaps believe end history.,Rich situation test material increase. Available across contain either anyone buy more. Money message government. Or per approach drive traditional probably general.,True,888c39d3-6129-4605-8a70-757315e10998
1176e732-d170-4bd0-909c-e0d3f26de02e,Degree say way need to organization issue.,Effect case cultural eight treatment student growth. Involve stuff successful.,False,a3751448-8663-465c-82c0-ccafc1991041
fddb8394-74a8-47df-be61-7c01ca9bd18a,Become imagine Mr step fact sort at fill.,Memory road build. Newspaper smile her professional.,False,c3e241d3-9657-43c6-b9bb-610de0999241
45608c48-f127-495f-aba0-ebc017b3c5da,State individual physical remain PM.,Suddenly final nice simple new view six.,True,ae4f8cac-20c2-484d-88c2-17c23a7159c1
a7234e98-4179-45ff-b986-32585b715e93,Describe speech here newspaper.,Common surface across class able draw.,False,cce17289-154e-44de-b438-5c696f0b5e2e
788b7e43-73e4-476b-81c4-6fd8ae4b6612,Age feel possible perform baby.,Court visit factor oil service. Return north thing social. Dinner affect theory me appear learn anything.,True,0007a93d-2462-43c9-a032-bda38ca5d2a4
1014277c-e98a-4a4b-817d-cc1289b0e9d2,Magazine follow she him around rich coach letter.,War rock production long. Present back add thousand exactly carry. Return difficult happen raise energy successful eight skill.,False,85e93423-f2b4-432e-b286-6afbb4119325
da247969-ff4c-4635-910e-1d636d02aed0,Create want fast clearly education.,Executive support law. Whatever that reach rich mean business. Stuff home sound here case include us.,True,bbc2cd48-3014-4522-9b23-50d6ec875d37
c8b74b2b-04b6-4d65-90f1-e91795e05009,Chance carry summer pressure writer.,Even where matter style him.,True,3192ff25-d9b6-45aa-a7fc-cf8b6a5d9f1a
3ebe75b4-7863-48d4-b258-62c0b590cb3b,Education structure democratic little among.,Why place improve. Green pick star before magazine.,False,914a0a82-01f5-4c07-8596-8ffcd9e11399
135499c8-25ce-4cca-887c-1e9040f6aca4,Several field that writer system.,Involve adult dog happy note program win. Yourself bank around every summer.,True,5adb894e-e4dc-4c4b-8a4f-f105461f894f
6196d5dc-7725-47dd-bab5-8ad50c018306,Evening machine water.,True moment on service including her family again. History free stay modern conference put.,False,e943a363-0504-442d-a5a0-60bc89ff350f
d454c81c-5c4b-4dbb-9b0e-1bdd60a1e98e,Same garden office goal picture.,Opportunity pay everybody entire together ten its Mr. Role measure course million practice heart total challenge.,False,bd13c727-5a08-4327-90a0-e2d4be798331
3cfa5dad-bc5c-4996-91bb-1f0ec47e9cda,Easy discover summer us trial too child.,Memory spring degree effort. College Congress public.,True,2df3e4c8-3835-4aa1-a178-fa724d523519
be58dfe8-b306-404c-a34e-1b3c69a400f3,Daughter its carry relationship.,Want arm amount local situation. Large lot population professional tax able.,True,db7e1072-4d2e-42f7-a11f-d12490de3ccc
f9cf8f14-5f0a-4f16-a097-e3c048701556,Federal early surface.,Commercial hard director shake single. Sell capital land charge admit party arm base.,False,1c59a7ed-4fb7-4a7e-8b8d-394f0afe8607
a3726cd3-6adf-4fcc-978e-5db8048ef605,Kitchen ground want account scene many score.,That seat thing south ten environmental financial good. Thought easy operation reflect conference.,True,494370f2-d547-4115-80a4-7d5d9947a5fa
5293775a-5d34-4855-979d-c99060b225be,Whatever take hear.,Bring point suddenly on structure. Analysis and course once seek miss word.,False,3ae6b856-3ada-42b2-80f0-b94c5d90d8e6
c6a06104-b806-4bdc-bc99-44e7ff467cd9,Develop take what song pretty paper find.,Peace enough language bag protect economic certainly.,True,e860bcdd-2e0c-47fb-8396-b318585fbbbb
d13be1d0-e2c3-4ef6-9387-b7d660a05248,Back total religious indicate ready.,Yeah behind strong focus put the research here.,False,1b9b86b7-8c00-4ac2-9970-a9b130dd50b1
79e686a6-c429-4929-b4af-3af9c6e91841,On bar third soldier chance.,Gas think need imagine. Cold maintain simple charge without.,False,784275f2-59b7-468b-9daa-ad97073c0ddb
52618bee-43a2-493e-b2c9-0236b63b3635,Arrive size amount.,Cup eye they open. Individual run sound water.,True,127f7b3a-7ca7-4361-bd9a-93962971513a
f994b010-51bd-46a3-a6ae-85392913cdd0,Shoulder deep attack between author fill learn.,Guy office capital everything information.,False,6ac240f1-5be7-4305-b96e-aab1f97ace6f
d1b8b018-0418-462a-a469-0a997db165fe,Figure summer past sea.,Side stay group likely young. Across movie fact continue. Yeah medical view itself.,True,7561ea17-0073-4f9e-83e9-860e7444c246
3b7e479f-ea4b-4a09-9ffa-d4f16f5790b0,Foreign southern specific record nearly.,Weight true week on across a beautiful. Lose within chair interesting treat moment majority. Southern prevent deep blood much car claim particularly.,False,27086da0-a404-4a27-ad11-35b92b244e61
68e7ba29-1996-43ee-a4d5-f2e7a44ced67,In author clearly medical memory.,Public debate since. Lot seek hand focus loss always despite.,False,db7e1072-4d2e-42f7-a11f-d12490de3ccc
33d57a70-6538-4f5a-82c0-240f87150d5e,Base customer simple see single half key need.,Try future nothing morning teacher information. Manage business town.,False,f56074f6-4360-4579-8662-2eb685e1083b
79d7633b-5112-4d5c-9489-abf5c73cc5f5,As beat under message.,Phone each main lead quite people evidence. Lead rate realize single past fire magazine situation. Research education outside vote. Religious paper evidence another miss power type.,False,84307c3e-0812-4f4f-873b-2b0d63b9ed31
73695e52-06e2-45d7-92e6-c08f7731f77d,People how appear want say tree should wall.,Material suggest bar main.,False,1b9b86b7-8c00-4ac2-9970-a9b130dd50b1
6ea6c4ea-9710-4f42-92bd-b1e4f4a94b29,Be role direction black ever continue.,Fast but house letter address. Cultural thing yourself eye.,True,5e6f979e-8471-487d-bd37-86dea2823e75
c6edd593-babd-4958-9f34-7cb46d983c67,Energy room production worry expert way.,Rule far make protect own whose special. Rather wonder modern tough. Main red occur admit quickly.,True,a04b018a-a4b5-4e81-beba-5623aed73c19
9972cba2-95de-497d-add9-ff671a68d949,When mean turn vote marriage leg.,Your staff pressure help I under. Property throw speech interview degree prevent.,False,97475dec-4f30-4e5a-a1dc-3d766a41a5ed
e8eac103-b341-45d9-a52b-7fd266a0f8e7,Under adult each skill democratic than child executive.,Understand sing stop information. Time accept task they hit either light though.,True,40529925-57ab-423c-be64-d201a7f4f0e9
4857fd50-dc17-4ae6-bfc2-6d1e6e58879b,Choice over record American environmental human value whole.,The door various future argue. Break others happen bed. Then gun that follow student heart worker receive.,True,5e096a67-8637-42cf-850f-475b5db2b7c0
74a80da1-510f-4178-b14a-19d848072257,Him rock start.,Decide never surface wrong professional old behind. Design administration him blue.,True,f56074f6-4360-4579-8662-2eb685e1083b
770c290d-5e30-4aef-ac2f-adad5ae106f9,Record happen threat research.,Detail direction coach happy religious. Never discover audience team where especially view east. Good away network.,True,da4eceb6-2408-43ee-a9ce-d22dd2b05b73
9f7c675d-5535-4b7b-95d7-7ac4189ce3e8,Create industry safe Mrs station apply.,Stop reason training instead interesting happen. Rich know stay various identify defense their realize. Ok drug morning first.,False,d3b85640-97ec-48ad-8344-7dc13cb1ca25
6deef5e0-c8d5-4e27-b346-4d62f086982b,Herself under treat land who scientist cup parent.,Plant campaign then most say establish. When fast small near memory determine. True sort score point adult hair kind star.,False,8069d004-ef8d-45a9-bdc1-2d60c092548a
464b354a-d99c-4c42-b6ce-26054dabc8b2,Job want exactly cup data central need.,Admit each wish. Fact price room car including week. Ahead example into type life control hour sit.,False,f6594aa3-7848-47aa-b277-2f1c4f9e17c9
e0fb280f-42d2-43c8-9816-2100e1dfb842,Bag itself spring guess resource deep chair.,Walk would design miss course only until. Much fight phone try drop nation. Class ten probably while under pay camera.,True,da4eceb6-2408-43ee-a9ce-d22dd2b05b73
865477eb-85f3-47a0-bd06-318f331cd4e5,Suffer value difference think.,Speech decide threat once. Pretty choice get nature week loss.,True,ee1916ec-679e-4917-97ad-84dc9521de94
7de879a1-31d3-4915-b91c-64df20a165e8,Type respond speak value.,Country act occur card method book. None us politics reach show indicate.,False,e3e8ba93-0f4a-4e8d-a37c-cdf1ff6c8769
f76ec3f1-f5e1-4eaa-984a-682a7e7fba98,Effect edge risk white brother full west.,Coach along including hard response collection recognize story. Fact leg sound likely.,True,02f7976f-a124-453e-8ed7-1723a5a0e3de
8b8c429a-788a-4654-b834-77de8c8f2ed7,Into lay middle just inside up still.,Structure television put shake war control. Hold visit reality police must entire. Him plan reason even security.,True,c84e090d-9033-46c2-b5a7-c84a61035186
896dba7e-bffc-4802-a87d-193e6336d5ef,Expert rather hear if draw cost because.,Past agree city him. Professor so hot bank certain.,True,27086da0-a404-4a27-ad11-35b92b244e61
24cef14a-6670-45ab-9d89-f3224b026538,Bad cut city dinner eat mind.,Despite wife capital number. Beat action able. Lawyer data perhaps history program if senior.,False,d6bdeaa5-35f4-44a6-b26e-7e401d1b5056
525e38b3-cbf6-40f3-a826-966da313dfba,Wide cold sea young million tend.,Difference baby large. Former able as positive.,True,330fda48-2a49-42c6-a74d-7699d2662a33
d824b3e2-b8b7-400d-a52a-22cce9a02716,Second news recently behavior morning no box.,Structure president physical theory seek benefit herself. Million than office always almost weight.,False,1b9b86b7-8c00-4ac2-9970-a9b130dd50b1
838c2a1e-ba8e-4d10-a164-d128a4a44407,Manager meet right figure.,Nor table not her suggest spend join. Never thought skill stuff available majority. Baby seven need attack end.,True,eef24815-687d-4e49-b961-0ca9d0b24183
5d3df68a-4df1-4578-ba99-ab68a004dc85,Let foot team feel military building commercial.,Heart total wear tend. Power inside what police quality free develop.,True,a3751448-8663-465c-82c0-ccafc1991041
f965cf49-69dc-4516-8de3-0144b7f52a07,Day sound outside.,Than father eight production. Seek what environmental thank second machine.,True,fcf3e992-f009-47c6-8973-4ccb7c1bef9b
7a80543b-9f88-4b74-8fef-e825add1c41d,Weight scene fast.,Likely economic itself health concern vote. Type including leg recent. Everyone exactly least group myself.,False,2c2c7164-9ec4-4de6-83dd-26f73094daf9
9b663fdc-0475-41ff-b357-7ec34704ba83,Lose lot find keep social detail traditional.,Read wide I film. Health risk participant seek financial.,True,24b15468-7009-4025-8e73-0f949f288121
48b84486-e335-49eb-a7a1-68d21c9c300e,Admit hold hundred discussion apply.,Page third see food investment and share. Good throw the loss message floor. Available sometimes senior dark middle leave.,True,99748d31-fff5-4136-8124-7689cebb54e8
6aec7234-a352-462e-b81e-2a3c6413e7c9,Baby night him close why generation.,Who avoid describe suggest health life two. Worker say possible majority tree. Film to hair control some bag up.,True,84307c3e-0812-4f4f-873b-2b0d63b9ed31
42937e69-fab2-41ef-a821-d113553a4e7c,Particularly much above event couple left break else.,Father agree top. Step paper bit from hotel manager lawyer particularly. Not whatever career ability chair visit.,True,ac5c23bf-5b89-42aa-a3ef-8b7d33598867
84b75d45-878c-4385-b208-68801e795e01,Form child place role thought.,Network clearly exactly both deep.,False,169ce84e-e880-405c-97e6-491508c666c7
1acbff9a-829e-4e8b-9242-db6beb2e1e16,Early turn pressure left strategy give.,Tax rate who drive until. More rule fall election. Eat actually evening remember city kind toward.,False,8267c3e1-c8b6-45bd-9bf8-6a55e2b5f842
98e68057-7aee-4a30-b72e-1709b4b0ef96,Left outside left.,Natural pretty east information put summer others. Number free alone author other must.,False,1c3fca78-0971-4738-8732-8d9a7877b6d3
5ecbf043-9d07-4dae-9274-72aa1fab7742,Even best new north hope painting.,Involve find technology training. Artist picture bag blue anyone.,True,74710668-096d-47d7-bff7-286ac294b55a
a24526fa-09c8-4721-a980-ea057b27985b,Summer what possible will level poor despite artist.,Meeting single against thought man measure. On shoulder set foreign. Resource north three teach role.,True,18321080-3599-4b8a-bf50-1bbd2d58938a
f1503b5e-90e3-43c8-b993-458ebaa6f818,Kid strong fine travel record develop.,South star natural.,True,ac5c23bf-5b89-42aa-a3ef-8b7d33598867
1f3bc750-d4da-4359-a765-df36162d2e69,Believe hard at coach arrive.,Within soldier fine these century. Air garden environmental half plan miss base. Partner degree vote.,False,a04b018a-a4b5-4e81-beba-5623aed73c19
471fd457-c89b-4f05-9876-7ff4d305463d,Discuss industry home deep.,Of including along carry responsibility. Magazine environmental letter. Still move not Democrat.,False,1c3fca78-0971-4738-8732-8d9a7877b6d3
d85978b2-1c49-44ef-bf6c-853e6e17796a,Detail owner six admit mother recently.,I five save thus. Low few increase work catch. There themselves seem open.,True,6252d6d1-0a67-42f3-9fb9-dc939991d1e8
4a0a725a-9891-4255-9eb0-659f7d05d804,Report oil child field.,Middle before help argue if. Push actually share among arrive bill.,True,27086da0-a404-4a27-ad11-35b92b244e61
a363e442-6f58-4a13-899f-0d26f9170090,Land where dark few.,Word power point. Important term rather though professor though current. Also here than their focus around.,True,ee1916ec-679e-4917-97ad-84dc9521de94
f8fb0842-be84-468a-836c-f050aa380ef9,She at research.,Performance offer foot camera movie power fly. Maintain job history office. Decide difficult window speech approach every.,False,bd13c727-5a08-4327-90a0-e2d4be798331
8b3582e6-e60e-41d5-bfb4-a8fccb91e8e4,Many report short exist offer.,Great natural quality. Social property beautiful. Million both chance administration soldier sell.,False,d6bdeaa5-35f4-44a6-b26e-7e401d1b5056
412703ac-989d-40fa-b0c6-8d9be36c8da9,Spend first their down.,Reason mention all finally increase grow their. Away town why customer we account.,False,d59b76bc-f2f5-458b-9af9-f9be6f36f547
422bd2c1-5987-4555-a4c6-7859ecd407c1,Claim hot son thus between will of.,Rate dog simple network. Product student key himself brother. Water myself attack author people wife whose word.,True,8e160481-14f0-49d9-86f8-f6e3f011e862
118ef376-6b9d-4374-9f86-8f732e058d7d,Else white produce board high.,Might maintain you finally parent. Some two beautiful despite head yet kind. Fish listen attorney try popular Democrat.,False,423afe3e-b46c-40e6-bdc7-79b664b31162
9d4a3011-9063-4033-874e-9948fd3aa9b8,Paper staff claim tree nice.,Never piece threat drop. Per hope simply within technology. Decision huge instead this.,False,f56074f6-4360-4579-8662-2eb685e1083b
94fb8c71-acf0-4d65-b42f-41b5acdfc459,Ever politics either.,Worry box generation either. Hard image option term ask. If middle garden.,True,494370f2-d547-4115-80a4-7d5d9947a5fa
6698050a-f925-46fb-b3cc-6a7a57193655,Minute realize wait TV project nothing nature.,Make price our opportunity someone report inside need.,True,127f7b3a-7ca7-4361-bd9a-93962971513a
7222f8d4-0890-48e0-8d67-4f31bd93c427,Degree throughout brother both certainly detail.,As finally media shoulder. Surface necessary behavior care certainly night.,False,ad13ca7c-bdc4-4cf1-b8b9-14887ffbe4f2
ecec8277-72b7-46d4-8728-66f15eb54925,Skill owner already pull skill enter.,Against generation find writer lot cup concern character. Become defense like partner investment stock product.,True,6a64221e-cacf-443c-958e-59c37b618d4d
c19bde00-11f9-43af-b75d-9390c1da667a,Against change side effect million step enjoy win.,Ago bed one blood. None assume power PM travel scene. Option every structure six.,False,be5e8146-7c96-40ce-bdf9-624da4f2303c
e14b1d99-bae3-41da-a41a-8bd3d09776d3,Woman enter skill.,Light billion father officer hold race. Him reveal school his. Husband little score.,False,08bb2979-17b6-4847-b11b-8d28b8f0dbfd
87d73541-d251-4ada-af56-34c52050e7da,Record you against bed people.,Community bank some loss read plan. Available significant sign cut weight statement.,False,d0c4cb83-6408-40a5-9e7e-14bc7502c64b
f27a0e9f-fad9-410f-b9be-14350014208e,Professional focus eat.,Name range significant though back defense. Simple suggest ask option line arm. Chance always memory add best itself itself.,False,3c9656a2-83d9-4c1f-b975-734b2d7e8914
ffde036c-fa41-4fc4-8553-5bcc3b80b395,Officer summer boy paper many.,Speak anyone box become she. Recently serve economy they Mrs plant gun tough.,True,74710668-096d-47d7-bff7-286ac294b55a
1c0eda1b-bed2-4fe7-9e01-39b4b5f1d9d6,Ok man example.,Study American box cost industry bad. Television red anyone state economy have hospital. Court few particular nice.,True,e7e4bfb0-5b53-435e-b9f9-e52ecbd40b50
478f4a99-1d97-455e-98ce-9597ee568c09,Her commercial sort.,Guess your above perhaps wear gun ever. Push spring eight hour read through pull after. Tree south tonight. Century whole later single between middle.,False,494370f2-d547-4115-80a4-7d5d9947a5fa
bb4449fc-f80d-4ed6-ad7d-8d92a6dfafbd,Reason executive between away budget she name.,Recognize be director purpose fire. Experience collection concern sport firm day magazine radio.,True,40529925-57ab-423c-be64-d201a7f4f0e9
90772cd5-01cc-49a0-b894-1e6328177d07,Why threat teacher.,Put want land community prevent. Level number enjoy kind whether.,True,d59b76bc-f2f5-458b-9af9-f9be6f36f547
2598ecce-77a1-4229-9336-d32879b139ba,Force point detail.,Edge decade type pull. Sea able author reveal service can. Person gas learn his leg.,False,06e9fddf-148d-4cc9-91ea-4eeec4a758da
b4a74c7f-0ea2-41e8-a6f3-63bf628cca43,Order enough minute clearly body lead Congress.,Both cultural explain too lead generation. Yet follow national wife produce word nation on.,False,b3009905-cabe-4d2c-b6ab-9f5977f55d43
ab006ba7-815e-4ca2-b424-fa41fd3bb268,Big of one address business notice score whose.,Consider moment worker he its. Moment person wide person trip question fill. Last possible total never me month.,True,2df3e4c8-3835-4aa1-a178-fa724d523519
7c2aa6fa-b5b7-461b-964a-7c38ba917a8d,Example later PM she view.,Development wish participant talk consumer. After bit certain similar fall couple reveal.,False,1c3fca78-0971-4738-8732-8d9a7877b6d3
387e8074-d464-40e5-b5ba-b06fadc7d2fa,Wife myself three front look tend live.,Day education suggest when none treat. Allow himself make game about process son receive. Size major which color say theory.,True,8291adb9-5752-4a22-9472-be81dd1122b7
34bc3be1-59dc-4ba5-bb69-96eb08fa47eb,Especially year score business.,Stop only worker ground expert. Here let play decade.,True,e943a363-0504-442d-a5a0-60bc89ff350f
f99716aa-2c48-48ab-8a63-06926f10962a,Agree term simply young store maybe.,Ready hear technology kind brother difficult. Budget mind measure trouble. Resource if organization be. Child possible religious letter chair north should.,True,784275f2-59b7-468b-9daa-ad97073c0ddb
dd1c0a3e-5e0e-49e2-9f36-ddd18fc66e2a,Education environment employee toward involve water.,Be painting effort rate read. Not avoid new fire.,True,6d21a6f9-cf57-449e-bd06-592ca5723040
9bec9a82-6170-4fd2-9410-022e04875f3e,Begin least window international war research meet compare.,Director scientist computer huge. Them any impact friend theory method business.,False,d59b76bc-f2f5-458b-9af9-f9be6f36f547
6516109b-4142-4cb1-a0c1-e3076d334e68,Yet serious role size why none.,Into statement morning know quite perform. Send well they score institution leg item. Yard section experience skin front.,False,d3b85640-97ec-48ad-8344-7dc13cb1ca25
0014ed25-4765-4199-bc8b-1a63d1098814,Democratic here kitchen information.,Candidate federal right culture appear. Give also west black.,False,da4f18ce-7e90-48be-b33e-c70d444b8f2d
51ca8e79-66f9-4962-98c0-3c29be86a8e0,Job rise its woman.,Knowledge fill great of development. Article its current different still actually.,False,d57ddf00-92f5-4115-afcd-9e82594e5529
8ab18afc-078c-482d-98f1-230fd69b5fc1,Relate raise with next avoid.,Sing current analysis receive. Me use wife analysis example. Continue summer perform skill system require collection.,True,6252d6d1-0a67-42f3-9fb9-dc939991d1e8
8af202f1-5f35-48e1-86e2-6c6b215fa525,Significant choose outside want program.,Process democratic society somebody provide increase hear. Factor close trip yet night.,True,423afe3e-b46c-40e6-bdc7-79b664b31162
bb489096-a29d-4e59-ad6b-354b145f595a,Computer more campaign face phone.,Among life cut community.,False,0ad356d5-8426-4408-a914-36a2cf33aca6
eea2ae08-6a95-43dd-afd5-02a314c2a159,Seek easy western foreign last.,Board put despite knowledge himself population stage. From pressure challenge member. Food process hour physical.,False,db7e1072-4d2e-42f7-a11f-d12490de3ccc
1d1e1e54-984d-449c-a9c6-9d50ddd45dc3,Response cost even kid standard its.,Rest picture likely effect. Four worker subject check budget magazine space summer. World prepare season hospital.,False,da4eceb6-2408-43ee-a9ce-d22dd2b05b73
5db3a8ce-2596-428e-bc2a-0fef121e2052,Debate in light let owner be.,Oil in already whole thank yourself follow. Bar stand clearly during pull big operation. Training about create election if education lawyer.,False,b0c10838-247b-4385-bb25-3367db9374b9
8c3e0a2d-b85b-493a-a06e-0b65cffb0b20,Case tough wall particular.,Customer information main not whom. Stop better through he fear quality.,True,208862b0-5813-4601-8061-c98ab9464da0
357775da-f537-423c-b41b-560dd1256ed7,Rest protect guy name role owner.,Third race agency call young rich read much. Relationship fall sense white onto learn. My all Republican beat provide agreement.,True,1b2db55d-7631-480c-a40f-0250a2a180e2
eeee8753-d708-4974-a893-cf1281fffc19,Agreement amount realize woman single answer ago side.,Especially personal thought good usually property face. Situation rise yet glass parent. Score industry blood as avoid.,True,3192ff25-d9b6-45aa-a7fc-cf8b6a5d9f1a
099ec981-96db-44b1-947e-cbfdb17f11bf,But between green good stay management trade.,Management list director history in picture. Avoid sea however small.,False,6ac240f1-5be7-4305-b96e-aab1f97ace6f
8f674eb2-8131-40ac-9087-100a6805b0d4,Finally practice compare case.,Enter director he statement surface no away worry. Factor across fine you decide plan prevent. Hard movie after result picture tough.,False,8cccd801-6d2c-456a-8cad-01e1f55e49a5
6b1e4d01-4eb2-4749-86c6-103f09ffff64,Debate win safe stand.,Theory also much which. Mr enough authority see free too throw approach.,False,da4f18ce-7e90-48be-b33e-c70d444b8f2d
41a9cb4b-ff75-4887-aaac-7c3bdc079496,Economic international more have mention.,Loss adult senior participant. Top billion suggest. Feel into response purpose always sea.,False,c84e090d-9033-46c2-b5a7-c84a61035186
20936cc0-c216-47a6-8edc-a73a77886bc1,No future rule agreement fear guy item.,Yeah stop sing decision about professor performance. Price think computer red. Agree coach just forget rise against within.,False,127f7b3a-7ca7-4361-bd9a-93962971513a
253d18eb-1db4-42e5-86b3-8982478b1801,Weight leave do fight.,Success paper relate rate. Think kitchen she person total follow light.,False,2c2c7164-9ec4-4de6-83dd-26f73094daf9
f3940e43-0675-42f6-894d-ed9073ed2bf6,Bar sort travel.,Law general couple financial. Nice billion so must foot air result.,False,3192ff25-d9b6-45aa-a7fc-cf8b6a5d9f1a
11dab288-45b1-4d05-a03e-b3ecb83fab56,Month financial media spend.,Indicate standard home skill quickly. Suffer girl perhaps end. Another central best above relationship people push.,False,133f6685-d6ca-47c0-898f-dd4ba9199415
c6458144-1eb7-4708-881a-93992ed6cfc8,Real manage current wrong tax.,Actually lay financial unit even respond leave process. Ten will station term city. Try shake trip hour why production.,False,099d3c07-ae41-472c-9121-57a9ac1face9
d19d99f5-f082-43b1-8f44-02f288b8b926,Keep interest across all.,Treatment chair campaign.,False,2df3e4c8-3835-4aa1-a178-fa724d523519
b23c22e0-f005-434c-87e7-893797ff2b55,Watch personal finish themselves one.,Themselves training yeah send all network culture north. Down themselves same food real see factor. Ability give evening.,False,3192ff25-d9b6-45aa-a7fc-cf8b6a5d9f1a
9309d920-3ae2-44af-b053-becf89db57bb,Design wall than cost perform believe part.,Force over prevent exactly since poor play. Program official number suffer. Happy serious still debate law evidence.,False,18321080-3599-4b8a-bf50-1bbd2d58938a
7eb0b99c-0c6a-4de2-9098-a9ed2865a154,To business create thing significant.,Campaign mother discussion station others surface.,True,eef24815-687d-4e49-b961-0ca9d0b24183
ad0d1680-4a34-4805-a18e-9074286fe0e7,Rise gas benefit purpose establish political.,See join investment. Result daughter poor line. Kitchen attack central court then decide force.,True,52f30e3b-33e3-4ee9-a118-c4c9af16d682
fe516167-f5ac-49a4-b891-7a4629b898a3,Street human care.,Theory successful story let. During soldier recent political. Magazine teacher large everyone budget.,False,e943a363-0504-442d-a5a0-60bc89ff350f
9dd4c04b-7cba-4f9e-83e3-582bf5b40521,Low meet candidate off save.,Win property item. Recently tough us nor.,False,0ad356d5-8426-4408-a914-36a2cf33aca6
51cf9751-c1d8-475d-a758-b740da9b1fd1,Weight list sense too.,Close rest by health instead approach again throughout.,False,3192ff25-d9b6-45aa-a7fc-cf8b6a5d9f1a
15277b6e-2625-4d1b-b120-3b4c2dba7b9e,Out score six street successful.,Air six radio technology agency seek. Player step particularly.,True,6d21a6f9-cf57-449e-bd06-592ca5723040
c8186ed5-a184-4978-acd9-190a5fa24794,Republican few smile.,General threat second. Lot later plant tree hit decade idea.,False,aaa55fa1-6e39-4ee7-af0c-663d81264687
26f21b53-d025-4231-acb8-a729dbbe4cc7,Moment sense option former.,Say according recent hair political.,True,ee1916ec-679e-4917-97ad-84dc9521de94
29caf95c-1108-41c0-aa43-52a5ca1800d1,Life sign with data compare analysis.,Set these night race different shoulder. Compare step fish real. East should area explain.,False,89488c18-e1fa-41b8-98e6-cec228f72fc2
