3f4f1a35-d831-492d-b1cc-97584d9f753b,Reason there teach everything instead wide whether.,Condition glass get social. Cup bed professional change.,False,97475dec-4f30-4e5a-a1dc-3d766a41a5ed
d240ffde-394d-4835-8f8c-c881214dac67,Source something national room draw media must.,Indicate chair successful nor treat window probably. Read quality visit community hot cause. Bed possible nation success action.,False,8e160481-14f0-49d9-86f8-f6e3f011e862
8ed6d765-5367-4106-9798-79fed5069b45,Sit about say he behind customer.,Determine catch foreign good success might Republican. Start affect skin nearly side rather focus white.,False,8e160481-14f0-49d9-86f8-f6e3f011e862
1badb3bf-2c15-4114-9f42-95d1ab2a47ba,They agency spring member treatment.,Seek make gun apply our spring. Plant gas event front today attorney.,False,e833cc3f-e647-4156-878d-f415f36dc68a
83d1f59d-3812-486f-a2e2-0d0f971d8f1f,Seat notice everybody movement machine.,Popular pay high.,False,6ce6dc9a-0592-493d-a1c9-2f7dfca09072
65aed03b-d88c-40e1-a372-9af427f4b636,Reality significant piece girl trade.,Candidate behavior control would summer cultural. Authority two remember society. College machine very away week.,True,a3751448-8663-465c-82c0-ccafc1991041
810bea9f-5a5b-4c0e-b7ca-2e170cee0736,Measure raise interest wife.,Shoulder friend administration bit travel often skill. Vote someone executive direction ball sister.,True,02f7976f-a124-453e-8ed7-1723a5a0e3de
22c9933e-2490-42b0-92af-8b0043bbcad2,Ball effect yes whom story why can.,Six herself during case. Follow nature beyond bed compare smile light I.,False,3c9656a2-83d9-4c1f-b975-734b2d7e8914
5aa4f6a3-fe91-41e4-97c1-5b51ac064b85,Head billion everybody read century.,Teacher physical gas popular him up garden. Plan pay approach though color career.,True,279df788-e569-4ffd-86ee-5e4430b117ee
f71a44f0-b852-4d0e-927f-7b974db144f5,Class realize natural establish TV.,Better everything exactly audience. Spring field where offer soon.,True,89488c18-e1fa-41b8-98e6-cec228f72fc2
19aa7698-3bae-40bb-9cba-47a9a47eeb10,Your against left federal.,Amount campaign condition finish yeah. Live do more capital. Front why community story house conference which.,True,2c2c7164-9ec4-4de6-83dd-26f73094daf9
3f2a5964-cbe6-4e87-9628-b43a3dd5b6b1,Them often quality small American sell door student.,Local would pay author stock effect capital.,False,85e93423-f2b4-432e-b286-6afbb4119325
a934aa1f-ada0-4063-8427-edebc502d2fc,Animal head player able clearly white back billion.,Yard amount evening responsibility bit grow. Near seven whether end theory.,True,75ea2896-0faf-4b95-9e41-71f14a7ee21b
10df272d-a530-4433-b415-f40924f42fca,Religious event ahead event throw increase.,Baby great three require growth.,False,da4f18ce-7e90-48be-b33e-c70d444b8f2d
f33b073e-3e9c-46b6-a6a7-bb39aab652a2,Interesting catch star various star experience.,Recognize end have begin summer any. Foot television many type. Identify call public single public.,True,3ce4a5eb-3343-48c0-aea7-5e75b3cc1ca1
5cfff483-f663-43c9-ad75-99cc2b6adcdb,Style audience source.,Keep war paper. Pattern north line during night bank partner three.,True,b0c10838-247b-4385-bb25-3367db9374b9
cd8e674d-ea49-4a89-961d-4013e94f8c11,Up hot method material tend hundred industry.,School rock heart project road million. Style serious among manage today store. Reflect focus catch dream.,False,208862b0-5813-4601-8061-c98ab9464da0
7ae150d7-570d-4694-abae-40a0dd7b0de6,Live international so benefit top seat.,Yes option hair call manage century. Recently late black left statement school. Direction million maintain staff nation.,False,24b15468-7009-4025-8e73-0f949f288121
b10681d8-b757-4c95-8e30-5bc203620427,Learn face by firm media leg.,Radio charge soldier property most. Right popular east.,False,e7e4bfb0-5b53-435e-b9f9-e52ecbd40b50
cead6e90-6866-4102-8882-88447cf3cbd2,Huge along along because process.,Computer could recently represent write. Such place relate similar key would happen. Letter truth it nature city development attention.,False,02f7976f-a124-453e-8ed7-1723a5a0e3de
f6c734f0-0bd5-45cd-a270-930413bc00bd,Throughout point put store identify mother administration.,Discover sit suddenly commercial sell everything popular act. Me show fill provide. Interest if model low case law.,False,b0c10838-247b-4385-bb25-3367db9374b9
526d9ea9-2e8e-4592-bf64-2ad63a60a7f6,Live final dream.,Together ask two away. Feel establish already third audience.,False,133f6685-d6ca-47c0-898f-dd4ba9199415
427a23f7-829b-4784-ac9f-28459debac36,Anything like reduce case live.,Real who politics cultural. Form hard source.,False,da4f18ce-7e90-48be-b33e-c70d444b8f2d
df6d86fd-12c9-457d-aa3a-f2d9a707234b,Yes almost hotel structure student.,Special memory hundred. Boy perform tree open risk.,False,dc4069f9-93f1-4c86-8f89-685bc3d5c28a
2089d5ac-63f5-4bdb-bac1-9a0c87d2f03a,Such science local condition.,Around positive sometimes identify light. Win because science reach history ahead. Her instead bed stay contain.,False,06e9fddf-148d-4cc9-91ea-4eeec4a758da
c667de78-98d3-4ac6-a565-6e2baf949c01,Down room ahead assume behavior.,Represent beautiful nature serve. Some accept important also. Religious sound almost dinner southern.,True,27086da0-a404-4a27-ad11-35b92b244e61
b3718b47-164c-4834-8aa7-3f13ed013ebe,Exactly the billion theory strategy sign.,Hot at move run no popular. Within such cut difficult.,True,6ce6dc9a-0592-493d-a1c9-2f7dfca09072
95969130-7eca-4447-933a-01be47dc752e,Whole similar six into much.,Quality blood road pull another less nearly material. Discover effort control live church.,True,06e9fddf-148d-4cc9-91ea-4eeec4a758da
9e25c1b3-e294-48a4-b58f-b2ea64b1967f,Traditional us day space cultural.,Stuff pressure style sea even. Campaign four technology eight.,False,ad13ca7c-bdc4-4cf1-b8b9-14887ffbe4f2
890db4d8-b08e-4e21-bdd6-9e364ef51294,Front door expert past party.,Trip between light series blood. Natural me treatment step field another fine. Available fight lot sport scientist.,True,169ce84e-e880-405c-97e6-491508c666c7
5cc984f0-f873-422b-bf00-5657b5a26d07,Send way produce finally a.,Return for may contain animal feeling. Professional paper name reflect read.,False,208862b0-5813-4601-8061-c98ab9464da0
e1dbdbee-f209-414e-ad53-7b7dc90b5758,Republican bank eye trouble model important one.,Break couple run sense. Of wife brother recognize air last father. Campaign whether administration.,False,ad13ca7c-bdc4-4cf1-b8b9-14887ffbe4f2
b77887c1-ac52-47b7-89d6-8084021a7786,Choose nature protect collection.,Five white exactly more. Industry whom moment area source mouth. Senior dog executive final process attack.,False,89488c18-e1fa-41b8-98e6-cec228f72fc2
91670bd9-d548-491e-bc4b-256d8374fcc7,Front company pressure receive close.,Guess everyone scientist performance college court marriage. Sign bring line affect probably tree outside. Model task wife including picture last.,False,494370f2-d547-4115-80a4-7d5d9947a5fa
da1c3377-50eb-4d88-84c9-962d83dfc9b0,Away onto wear senior.,Certainly authority research evidence by. Usually leg traditional leader. Vote level middle indeed need score.,True,f56074f6-4360-4579-8662-2eb685e1083b
f6c09658-19c8-4cdb-a387-bf3d18ddf714,Wear campaign training thing popular sell.,Hit speak visit foot hospital condition message. Decision thousand human girl school find scene.,True,d0c4cb83-6408-40a5-9e7e-14bc7502c64b
974689a3-c161-411d-8ec6-f6a5d82bc415,Blood or campaign listen center poor.,View rest stop course trade across. Occur prepare pay fear feeling.,True,423afe3e-b46c-40e6-bdc7-79b664b31162
49df1d59-6d5a-43bd-a171-16d40863ebd3,Throughout value structure together day hot door.,Page student ball listen structure role protect. Scientist station benefit try themselves interesting skin. National like alone hope.,False,8267c3e1-c8b6-45bd-9bf8-6a55e2b5f842
e1dd258e-a9e8-466c-83a1-7bdbec74de9d,Likely forget civil TV couple carry thus market.,Enough than expert human accept. Picture student look far north especially reflect probably.,True,6ce6dc9a-0592-493d-a1c9-2f7dfca09072
40cf1b63-774b-4ec7-9042-4d190be621ce,Full care work Mrs agree.,Wind week law use area eat. Out general talk company interesting.,True,330fda48-2a49-42c6-a74d-7699d2662a33
68bf6457-d654-40e2-9206-51f168d9be08,Including per either available.,Billion both through miss. Push meet church meeting office. Girl soldier exist social only none.,True,6ac240f1-5be7-4305-b96e-aab1f97ace6f
bf511786-7d8f-4618-b3f7-7baa2abcdda7,Laugh dream among spend political would hard.,Responsibility consumer ok recent always.,False,99748d31-fff5-4136-8124-7689cebb54e8
132fdc05-d59f-4b1b-bef2-54c85c458194,Laugh executive manager trade enjoy huge.,Purpose assume news staff. Realize because agent medical result. He rest once however room player. Final point short floor clear nor grow.,True,133f6685-d6ca-47c0-898f-dd4ba9199415
48f397aa-24f8-4bc1-ac66-1ac38b601aaa,Along yeah why.,Fill like air our art join brother. Us understand town.,True,99748d31-fff5-4136-8124-7689cebb54e8
cf5e66a4-a8e0-4bc9-b0ad-fc1af7f217b8,Scene business industry power above example.,Land our least high different. Face anything interview fear around theory.,True,3ce4a5eb-3343-48c0-aea7-5e75b3cc1ca1
b4843463-9277-447e-a0f0-8d796d13624e,Character because stage it report senior something.,Spend edge traditional recently Mrs. Here old go play true.,True,5d0fbfd1-47e6-46ba-b001-20d175b74c55
6e0ba04d-78e5-43e9-8a66-8f56676da1a5,Behavior where while control.,Meeting evidence capital little manage fall. Involve less note rich stock high party member. Information only check.,True,97475dec-4f30-4e5a-a1dc-3d766a41a5ed
5d1f9f7b-4cad-452c-8dfe-ae039091221f,Student employee change woman market.,Help figure present religious into thought energy. Seven card some thank.,True,203b8277-17e6-4821-9e1d-fe6daa7a826d
ff64b048-98a8-4bd2-9939-2fa54b228a67,Upon board sense hair.,Hair bar keep effect. Executive talk only purpose least military.,False,133f6685-d6ca-47c0-898f-dd4ba9199415
b2a4eb4d-01d5-42de-9865-8729f5930ce2,Compare growth pay catch better.,War conference court bring. Between impact service activity woman usually. Yeah appear five war major foreign cover.,True,6ce6dc9a-0592-493d-a1c9-2f7dfca09072
2e5be46d-dec2-4dda-9c9d-975b0a471b08,Treat song she herself see mouth ball.,Management people image your dinner budget clearly. Voice star senior mission.,True,6ce6dc9a-0592-493d-a1c9-2f7dfca09072
75162fe1-a249-4995-8708-672d45bf994d,Million building her help health public.,Suffer guy include state everyone local large. Company develop administration available senior down beautiful medical. Federal open music answer girl want.,False,52f30e3b-33e3-4ee9-a118-c4c9af16d682
baa37133-c0bc-4eee-b52c-6995ade2bf0e,Visit a race since difference.,Front term with PM this. Look technology town most.,False,784275f2-59b7-468b-9daa-ad97073c0ddb
985b50b7-f715-401c-aab8-d674f088ca54,Decade sure Congress back story beyond former.,Its clearly most then each plant. Claim whom well show record.,False,ac5c23bf-5b89-42aa-a3ef-8b7d33598867
2d332e16-0844-4139-b6eb-232293a8df93,Them in quite national.,Human add central order. Both little a customer.,False,8069d004-ef8d-45a9-bdc1-2d60c092548a
cd6038e7-852c-452b-aae1-1880680ad9e6,Door support late past important.,Here claim say I message rule meeting. Media plant race if road instead night reach. Leave price ago long over raise morning.,False,3ce4a5eb-3343-48c0-aea7-5e75b3cc1ca1
88078aa7-2031-4138-824c-e0cb6c6d094e,Protect culture carry wrong doctor.,Structure but become voice real technology no building.,False,169ce84e-e880-405c-97e6-491508c666c7
c4b1a0dc-f29f-4db6-b0ed-55098b90ce84,Everybody remain understand boy.,Push who lose buy. Total these respond back teacher see every. Wide believe for listen character.,True,8267c3e1-c8b6-45bd-9bf8-6a55e2b5f842
3116efd2-1247-4d70-b3fe-3b6bb4c37ed6,Threat protect become house sure.,Tough quickly wide quite station. Fire amount century why present.,True,203b8277-17e6-4821-9e1d-fe6daa7a826d
a6ec0fb2-f524-4ad7-a111-8ab8340bea56,Set garden success it.,Activity administration degree herself. Among score both wait boy believe its. Respond lose down director situation unit after.,False,74710668-096d-47d7-bff7-286ac294b55a
8fd36b7d-7808-438c-a3f3-b27f710c3c19,Foreign question everyone.,Wrong appear but trip exactly key son. Ball source deal all live.,False,99748d31-fff5-4136-8124-7689cebb54e8
8b251a67-2bc0-4053-b1c9-61d9eb6cb9d7,Year mention mouth they drug cup.,Race teacher upon author describe safe ability.,False,d59b76bc-f2f5-458b-9af9-f9be6f36f547
d11219a3-42f6-495a-ac57-293f4d58bdd2,Rate who speech ability tend hold.,Then analysis north art. Significant area difficult church.,False,279df788-e569-4ffd-86ee-5e4430b117ee
aaae5c15-6bcc-4ea8-abb7-67f64f13eccf,Father hospital account write order rather.,Own billion employee Mr story yard ready. Material base reason leader you probably control. Public again both six court lawyer.,True,1c59a7ed-4fb7-4a7e-8b8d-394f0afe8607
fb2f25b0-e205-477a-86ed-4efd4f73eb57,Rule majority adult.,Want relate coach whatever if. Wall door sound lose three. Difficult culture spend fire smile style everything president.,True,6ac240f1-5be7-4305-b96e-aab1f97ace6f
d8c5271d-27d4-454d-b701-45d22809d0f8,Reduce open experience sound.,Central raise claim direction organization. Generation always group green. Leader through yard.,False,6d21a6f9-cf57-449e-bd06-592ca5723040
a8c69a8a-a24b-47d6-82df-ee59eb2f9a68,Start fine lawyer situation pick traditional forget.,Year specific management close close natural. Dream feel task treat a country. Democratic quite represent support nature democratic personal.,False,18321080-3599-4b8a-bf50-1bbd2d58938a
3425d6a6-a53b-46e7-97e5-cd8ec56f4233,Those test market right.,Table middle or. Site perform wrong. The couple leg buy difficult cost.,True,279df788-e569-4ffd-86ee-5e4430b117ee
58ec6c79-d577-451e-b850-09f7f8ea9642,Study attack same campaign receive represent reflect.,Talk wide consider place quality size return. Single sing letter professor. Night much coach tell.,False,e943a363-0504-442d-a5a0-60bc89ff350f
602f9779-e718-4e19-ba24-04788aa33987,Strategy thought want catch doctor.,Color plant son politics add sense benefit six. Agency city want financial civil energy send.,True,f4439c98-e789-47ab-acb0-d107c651a778
7fdb31e6-0754-4898-8522-3ec7b53845d3,Yet past night answer mention off production.,Concern director toward old best what scene religious. Drop partner address instead dinner today.,False,24b15468-7009-4025-8e73-0f949f288121
2791f079-cd62-48ef-9247-55dd1b8239f5,Common after common.,Discussion weight full. Give make strong black debate operation cost face. Condition exist media different practice focus.,False,914a0a82-01f5-4c07-8596-8ffcd9e11399
d811e3ef-1340-46c9-a77d-b5542914b306,Perhaps safe event seem five.,Decision much far interview home. Into bag look spring. Relate technology their benefit focus heart.,False,784275f2-59b7-468b-9daa-ad97073c0ddb
15842279-efb4-4aad-8f24-be8114f064fa,Why since nature gun million stock likely.,Dog simply opportunity size. Require and development maintain sound factor parent. Question mean name herself.,False,bd13c727-5a08-4327-90a0-e2d4be798331
ab17efa5-cd24-4e33-ab45-274bd5ff33f2,Material per maintain quite star attention land talk.,Order anything subject begin almost claim. Street always yeah these build trial data. Shake but serve.,False,97475dec-4f30-4e5a-a1dc-3d766a41a5ed
551847b9-3611-420d-b0ea-65176a703809,Floor they attack certainly ball some nature.,Particularly hope child majority page drive although. Price go work item they.,True,da4f18ce-7e90-48be-b33e-c70d444b8f2d
79761756-c24c-47ac-b4ed-4cbd7c58070d,Draw at project sense wide unit.,Very about hear news. Along parent across wrong pattern two unit. Leader perhaps special theory care occur rock. Once member outside series region concern should he.,True,dc4069f9-93f1-4c86-8f89-685bc3d5c28a
c83dd219-2760-404c-b9e4-7f82a28a03a5,Total past food source strategy his rise.,Treat miss a thank physical. Hour mission politics who heavy. Sell draw although couple unit. Field size floor easy while understand.,False,1c3fca78-0971-4738-8732-8d9a7877b6d3
3f69ba2c-f5fe-481b-9a83-d32abc5f8205,Play usually moment week order really.,My west level trip hotel end. Level building fund most back.,False,3c9656a2-83d9-4c1f-b975-734b2d7e8914
1b4488bc-d7a2-420d-8e8b-83adcc876042,Religious public same administration no him.,Similar last hard item child. Boy land speech.,True,279df788-e569-4ffd-86ee-5e4430b117ee
5da02c37-4ef5-4edf-a90d-cfe88232758d,Dream speech either nearly direction walk.,Particularly price baby feel spend owner agency. Democrat example author expert different market. Difference consumer visit indicate institution business sister pay.,False,c84e090d-9033-46c2-b5a7-c84a61035186
274143ed-cf3c-4e96-ac5e-ee87c255005b,Certainly special parent player treatment stage easy.,Eye couple world series police yes impact. White last say throw. Wind look language officer front.,False,8cccd801-6d2c-456a-8cad-01e1f55e49a5
2f668cbc-51be-4ced-87d7-f4e6171768b9,Arm institution concern myself sure.,Suffer crime for range do actually. Beat line personal both green finally.,False,5e096a67-8637-42cf-850f-475b5db2b7c0
567b892b-ccad-4b9d-876a-8594f882d1ab,Already indicate should class knowledge.,Compare main piece leave. East industry human happy entire buy.,False,169ce84e-e880-405c-97e6-491508c666c7
a0b6dd55-47da-4b4a-abd2-277b5175e974,Focus author after.,Number mention art. Look government decide small either sign who.,False,aaa55fa1-6e39-4ee7-af0c-663d81264687
10b6b840-9c8b-4cae-878f-a283ab682ab6,Or herself card himself star.,Physical agree and put add American. Such travel never east single matter color.,True,6252d6d1-0a67-42f3-9fb9-dc939991d1e8
ea562629-26a9-48c0-9ae5-804e9daed84d,Rate most pass around themselves generation usually.,Learn population member professor white piece much. Consumer good authority themselves successful street.,True,24b15468-7009-4025-8e73-0f949f288121
494757c1-52eb-44c0-9875-2120927d08f7,Plan lose art professor.,Write themselves appear. Scientist while claim rule goal. Second director memory address model kind.,True,40529925-57ab-423c-be64-d201a7f4f0e9
09a562b6-2b4f-47ce-a612-679f4a121e8c,Want really me.,In letter open week issue official own benefit.,False,fcea6a39-663d-4e3f-ac79-a42c768d2425
b2cf2cb8-54a8-4070-867e-74442aadd192,Several increase effort require almost see.,Never season join address. Eye movement political direction be. Term perform list rich.,False,099d3c07-ae41-472c-9121-57a9ac1face9
366c39ca-5769-40bc-acab-6647feb79f82,Computer large magazine he special budget.,Science doctor prove safe heart especially over. Wind your mission information especially.,False,d3b85640-97ec-48ad-8344-7dc13cb1ca25
19b6521b-afe6-4394-9229-f1fd65706bf7,Off window bad lawyer town debate health.,Power until seven ground design. Admit line this. Her make real nearly picture whatever. Act across despite explain garden around history.,False,099d3c07-ae41-472c-9121-57a9ac1face9
36461460-1e9d-46c2-8d78-e2c610f18b5f,Strong get finish box same happen contain relate.,Change sea course range price personal. Media tree however study even take ball.,True,279df788-e569-4ffd-86ee-5e4430b117ee
406ad7a1-3b27-4f02-b108-cd681cd3e354,Whole resource people.,East who visit college way we again party. On method think someone. Dinner how staff school serious summer indicate.,True,27086da0-a404-4a27-ad11-35b92b244e61
a82833bc-2ef9-46f7-a4b0-c93041102e1d,Decade agent reality either mother spend almost.,Term memory drop guy. Phone majority turn participant will low right.,False,27086da0-a404-4a27-ad11-35b92b244e61
e4b21807-deb2-42d5-8992-4acbf2709bfc,Why environment seek oil city myself special everyone.,Mission push control seat soldier language anyone. Organization let pass actually pretty two. Entire peace training.,True,f4439c98-e789-47ab-acb0-d107c651a778
941a2496-fdf0-4422-a094-ea6f079d1c1e,Teach sing grow official close.,Kid thought bag discuss partner toward know. Car quality idea down subject save college.,True,0ad356d5-8426-4408-a914-36a2cf33aca6
54fc6050-11e1-4602-b765-bcbb6db513f6,Upon response down attorney note rule.,Somebody bring treatment crime artist. Decision reality sort free person benefit. Whatever ask respond group television.,False,40529925-57ab-423c-be64-d201a7f4f0e9
8afd5c16-fd80-4147-a47c-d89974dc0f49,Green meet protect amount.,Just option research management conference treatment behind. Issue music deal computer society individual. Sign baby keep certainly understand out.,True,127f7b3a-7ca7-4361-bd9a-93962971513a
c2d0f4eb-a360-4adb-80a0-c1b6bc7e9ff2,Rather feeling figure concern begin her.,Dark role suggest name low voice full. Pass teacher today action arm.,False,6ce6dc9a-0592-493d-a1c9-2f7dfca09072
5e85b7d7-a1eb-4822-935e-9e666a2ea160,Article west compare fear camera paper position.,Safe identify pretty student war seven talk church. In read ever say own physical blue. Body system read land deal.,True,1b2db55d-7631-480c-a40f-0250a2a180e2
9cafc990-fc3e-4a0a-b2c2-c88ab64df7ed,Similar become everybody city.,Find beat enter such coach call. Society people effect themselves beyond site.,True,127f7b3a-7ca7-4361-bd9a-93962971513a
9e740363-7c92-457c-84e0-d077762595a7,Especially book culture office.,Source spring professional hair each life.,False,a3751448-8663-465c-82c0-ccafc1991041
8efe95dc-b7a3-470b-96fd-093eeb1b24bf,Method deal base himself.,Professional improve discuss no statement world. Western program assume available option radio. Site summer record rich sense century. Five arm ready end.,False,3ce4a5eb-3343-48c0-aea7-5e75b3cc1ca1
a120c45d-d8a5-4498-b0f6-63a38ee251a5,See room any bar feel institution final.,Reason than without feel public scene learn. Peace none both concern possible. Happen way significant feeling perform.,False,ebd2c27a-ab7e-4d48-84b5-417eb7b27b42
9d93e910-91c1-44df-a9e6-63f5485df0c8,Action policy bank book language modern entire system.,Traditional west appear lawyer beautiful citizen travel production.,False,1b2db55d-7631-480c-a40f-0250a2a180e2
6ce02c95-eed1-473c-8bf8-345c49365235,Go do general road tell.,Style certain product wrong cost. Also bed claim provide purpose list.,False,b3009905-cabe-4d2c-b6ab-9f5977f55d43
ecd542d7-b02d-42ad-b47d-7f2e303b245c,Hand medical culture.,Field investment spring world process already level senior. Thousand role news onto. Pay long better call hundred wide only.,False,da4f18ce-7e90-48be-b33e-c70d444b8f2d
78eb34b2-280e-4d2c-a8c7-4210ea4b0275,Measure support standard nearly relationship.,Forget short trip forward. Throughout box hair realize big each. Election growth mean outside. Play night so executive.,False,27086da0-a404-4a27-ad11-35b92b244e61
1a7cad1f-338c-45b1-ada8-050f777a5a3d,Issue anyone feeling have.,Happy cell minute four. Customer whatever name pretty catch.,True,6d21a6f9-cf57-449e-bd06-592ca5723040
8ce86bde-90e3-4f7c-a0e8-71bbd57d50a5,Significant question sell phone half too scene system.,Test also account series. Nice adult central suffer wall.,False,f6594aa3-7848-47aa-b277-2f1c4f9e17c9
6fcffd49-a009-49a2-914b-9bcda7402e87,Current they week interesting.,Reach pass work can easy crime better. Expect budget left no control food.,True,ac5c23bf-5b89-42aa-a3ef-8b7d33598867
4c0c4946-5ffb-46fc-ac74-247a6276e29e,Over top well group rich present international.,Moment hear answer commercial. Range word case rich. Light happen financial feel.,True,f56074f6-4360-4579-8662-2eb685e1083b
c614e650-0c5a-44e9-9984-2a9883ae571c,Safe suggest role.,Try business show. Letter should between. Lay however thus sign wait. Teach point fall affect hard woman.,False,bbc2cd48-3014-4522-9b23-50d6ec875d37
3084d561-db1e-4391-aa32-28b3ea3d9881,Itself key control past.,Already station indicate fund issue. Late call social myself professor public.,True,8cccd801-6d2c-456a-8cad-01e1f55e49a5
eb4b748a-23b9-458e-86eb-dc438561b28b,Deal book age animal investment.,According throughout perhaps health. Chair thing price there call my watch.,False,e7e4bfb0-5b53-435e-b9f9-e52ecbd40b50
8cca0d96-491c-4d80-b9c0-98ee0e3ab4e0,Bank church suffer carry father guess speech.,Tv really foot sort experience marriage deep. Modern knowledge western moment. Dark write course also science sometimes.,False,3e2d34c8-213f-484a-a98e-ebbea5245a09
2e6b0dd2-753f-4293-b121-fa98e0803439,View night one especially feeling concern nice.,Finally rock exactly a tree answer become. Likely gun much apply force down cost be.,True,c59e04c2-80dd-4c7a-b602-48a089f771e6
91efd702-b7f8-4df5-9ce0-041720563671,Station reach job sure indeed experience.,Only month character service personal language put know. Box program question both treat sport.,True,40529925-57ab-423c-be64-d201a7f4f0e9
3860bc9f-f4ba-4966-909b-efc963e481a8,Collection southern not up.,Rather local when national wonder might. Nice before discuss mother read. Try serve myself fast. Through great use.,False,6ce6dc9a-0592-493d-a1c9-2f7dfca09072
595e4b1b-ab23-4076-9102-3be6efbd5008,Can approach base.,Particular just painting time reality defense our. Wife example theory business return she.,False,914a0a82-01f5-4c07-8596-8ffcd9e11399
a1d19602-585d-4176-8b6c-dd480e4e7926,Push ability painting property eye her.,Day guess end because local section talk audience. Respond far thing question gun by hard stuff. Debate hit able author.,True,d3b85640-97ec-48ad-8344-7dc13cb1ca25
b30fecf1-316d-4e80-a5ed-9982fc689841,Seat whom side several idea either southern.,Over rate hand decade rate. Foot safe which good despite place.,True,423afe3e-b46c-40e6-bdc7-79b664b31162
720b26b4-59bd-4ed6-8ad9-9b03241148e1,Candidate onto American life.,Once account choice west go. Do range eat increase.,False,8069d004-ef8d-45a9-bdc1-2d60c092548a
5400dfa7-fb9a-4654-9bbb-a46a5c05adba,Rock large ability ever here.,Share phone population. Sound resource since.,False,ae4f8cac-20c2-484d-88c2-17c23a7159c1
