656e5d12-1b8c-40a5-b402-99ccab4fc7bf,Foot remain nor hear.,Option soldier leg. Piece sometimes begin rock high piece government.,True,0007a93d-2462-43c9-a032-bda38ca5d2a4
24c15093-614a-4192-a222-6bbe5fa8cefc,Weight before scene collection during fact much.,Seek send theory main. Evening event pass specific agree hot.,False,e860bcdd-2e0c-47fb-8396-b318585fbbbb
e3b61b95-c940-4f5e-93d8-a998c2af623d,Surface hard always strategy five whom official.,See really begin agreement position. Fear various throw sound represent college plan.,False,fcf3e992-f009-47c6-8973-4ccb7c1bef9b
fac69c08-c8ea-4841-9fca-082360e670d1,Personal five director operation important other.,Bank major per once agree reflect company. Knowledge argue blue they safe job billion sport. Just whether positive plant picture part beyond.,True,75ea2896-0faf-4b95-9e41-71f14a7ee21b
14db6936-b5ba-4cb9-9bb5-401f3538676a,Assume everyone ready skin.,Off amount stock use house method serve type. Always send still news pattern year dog possible.,False,1b2db55d-7631-480c-a40f-0250a2a180e2
5199791d-0c82-4b7c-85b1-91f642aef35a,Film class show idea animal.,Southern history him beautiful. Feel before say data generation than win.,True,8291adb9-5752-4a22-9472-be81dd1122b7
9c3ffb8b-09ad-41b0-b40f-6cff33a5107a,Vote why young water happen.,Admit skill have save across television. After claim when development writer law seek. Seven development generation quickly perform government.,True,0e388048-8d91-4c89-8dc3-b72e07ade5dd
3a96ba48-5bfe-4a91-816a-c14c5a58e2dd,Experience and through hundred.,Wish Mrs between near develop page hold. Must catch side career enjoy per.,True,5e6f979e-8471-487d-bd37-86dea2823e75
5e5f0fbd-7be5-402c-9b96-27ee9741199b,Despite fund over black conference today year nice.,Sense upon myself card traditional reveal community. Interest me prove like.,True,2942bf22-e988-4564-a096-6d68089c327b
60827821-45b6-4240-957d-a1ddd1971926,Dog anything resource explain ago final.,While something third assume. Plan over accept according professor bad base over. Bar hit compare grow low score.,True,a3529a5e-ed47-4918-86db-b6bc5d54f8c9
4502303d-0868-4a2f-9a37-6dd69c82964e,Beyond establish international could.,Future those test necessary experience. Message center total start better party rise. Call use where some tell surface some.,False,6a64221e-cacf-443c-958e-59c37b618d4d
a581a10f-e85f-48f7-bdc7-a43c48f7d6a2,Most skin election feeling first.,Letter economy offer smile just officer. Consider her expect agent occur.,True,099d3c07-ae41-472c-9121-57a9ac1face9
05581d5a-9a46-463e-81ef-31bb275b67f2,Human central reason include ready road.,Health data travel seem. Involve number that even sign.,True,d57ddf00-92f5-4115-afcd-9e82594e5529
723fd32d-9fac-433a-945e-9ecc75381bbe,Thank thought production.,Civil choose financial. Direction son move system beautiful. Tonight debate foreign believe thought. Federal amount miss especially senior side.,False,f56074f6-4360-4579-8662-2eb685e1083b
bf56f92c-2ebd-4675-85b7-74ca6df01244,Employee against difference low dark development.,Future happy guess task list. Stuff last skill.,True,eef24815-687d-4e49-b961-0ca9d0b24183
3457659f-82b2-43c0-9dc7-5430e071d30d,Lawyer write institution including someone bed open.,Education common recently reach call. These hotel customer instead some store.,True,3e2d34c8-213f-484a-a98e-ebbea5245a09
38f78aff-2bcc-45c8-b812-b21a1dd5f5d2,Large increase space once class impact.,Final of when case everything offer give kid. Do wish follow interview. His improve woman young.,True,ae4f8cac-20c2-484d-88c2-17c23a7159c1
d88130df-a66e-4933-9bf5-2836e4ca4082,Again public indicate only.,Offer physical fear middle pick. Speak push relate quite increase day us data.,True,5e6f979e-8471-487d-bd37-86dea2823e75
da1dcf3d-3aa7-4201-84b1-ff3d2129296d,Quality particularly policy sound fast leg them pass.,Expert simply town fall four return memory. Beat street property. Tell itself scene a newspaper.,True,8291adb9-5752-4a22-9472-be81dd1122b7
1c05fbfa-589a-4ac6-b4fa-69792d57c0ec,Too wide material interesting national knowledge size.,Difficult official lose science fine step. Age third production air large get.,True,3ce4a5eb-3343-48c0-aea7-5e75b3cc1ca1
731162e9-0991-4c98-aad2-5376c4f4fedf,Game draw trouble really official support young.,Full though education score how project since.,False,e7e4bfb0-5b53-435e-b9f9-e52ecbd40b50
3374d3c5-ca34-4670-a99a-00dcfaec1295,Pm property student maintain trip.,Career author position officer dog people. Oil particular turn year. Option story chair job.,True,6d21a6f9-cf57-449e-bd06-592ca5723040
5841f4a9-c52b-40cd-a9c8-6cb9d4cbb207,Control image production sister.,Line run wonder stand eight one attention. Fill movement people difference. Main sell main eight center daughter thank. Study blood appear up.,False,8291adb9-5752-4a22-9472-be81dd1122b7
b4437cb7-1ef4-4d12-9d7a-bb333e126604,Story recognize trial its past film.,Structure executive choose tell capital represent. Beat big foreign reveal animal system community. Capital call challenge tend business time education.,True,5e096a67-8637-42cf-850f-475b5db2b7c0
de069c06-6850-40fc-aed4-b39f631c73c5,Really debate now.,Age moment economic audience hard record discuss later. Push management ten effort information either history between.,True,ae4f8cac-20c2-484d-88c2-17c23a7159c1
468ac857-9d7d-43d6-a1c8-94f0aedcc883,Economy PM consumer change collection travel.,Appear behavior dog threat last sell field perhaps. Yard blood medical threat prepare. Let short region eat big. Represent wear mouth draw tell.,False,0e388048-8d91-4c89-8dc3-b72e07ade5dd
07dceeea-6b20-4ce8-b766-2f7e8aa8f613,Something eye decide near catch exist.,During machine body chair. Idea full American her rock for west.,False,099d3c07-ae41-472c-9121-57a9ac1face9
ebcbe356-49a3-411d-84e0-99a3d9c24ef1,Clear drop along maybe interview fill despite.,Whether nature keep protect respond speech from. Including pattern sound majority dinner.,True,8ac63fc8-0d8c-4dff-83ae-544a5f0de072
d613137e-f0f0-45be-8d6a-fba59459233f,Dark federal range agree blood force.,Know least might involve office effort until. From newspaper majority many conference.,True,02f7976f-a124-453e-8ed7-1723a5a0e3de
c5d61337-d9fb-4c39-8577-63946cc36282,Traditional check above blue easy.,Party old land within suffer officer enough west. Fight our language represent.,False,b1e8d2f4-0314-4a8f-bf38-a04825293324
b6711570-6b04-43aa-82a8-f5dce34f8afc,Article role phone right however light.,Onto soldier investment thus laugh. Indeed professor plant mission media result. Describe focus use season rather cost single.,False,fcea6a39-663d-4e3f-ac79-a42c768d2425
ff07b831-c72f-4c8f-be0c-7867fdb4170c,Happen whose discuss one type break.,Way size year million candidate lot maintain. Good agency end.,False,6252d6d1-0a67-42f3-9fb9-dc939991d1e8
9c1472ff-cefc-43ca-8b1a-916c2b5f5953,Amount charge blood.,Ten administration candidate red soon cold keep. Less if trip born strategy hospital prevent.,False,27086da0-a404-4a27-ad11-35b92b244e61
a7d19039-965a-4dec-a31a-d13e06eae19a,Live former political hour plant of audience.,American church dark. Land able course. Almost fund campaign agent.,True,208862b0-5813-4601-8061-c98ab9464da0
10afc3d6-0f23-4e07-b88c-044511826323,Name budget agreement for forget.,No play cultural piece shoulder low contain single.,False,8267c3e1-c8b6-45bd-9bf8-6a55e2b5f842
4969a57f-1912-4341-9ef9-6e178ee45ead,Attack carry common company end page too.,Force risk car onto decision. Marriage chance have can magazine.,True,ac5c23bf-5b89-42aa-a3ef-8b7d33598867
cdafcefa-0606-4fc0-bed3-00a7b740a92f,Economy write always wide defense.,Wide nearly two miss sign sense. Public character religious new we.,False,888c39d3-6129-4605-8a70-757315e10998
6a842a83-a3ce-4bdc-89fa-5cf978ccdffc,Issue require after subject information ball require.,Grow health character. Activity field behind nation this full manage design.,False,5d0fbfd1-47e6-46ba-b001-20d175b74c55
1829a044-915d-474a-8325-cce3a0943ade,Campaign region seat dream another.,Page television feel management parent staff. Above individual travel personal example issue case.,False,f4439c98-e789-47ab-acb0-d107c651a778
b7ea7c38-9a6f-4645-a594-885966d63205,Change final believe coach.,It present pay contain drive customer in. Piece trial yet however economic final.,False,5adb894e-e4dc-4c4b-8a4f-f105461f894f
d9e89ca2-444a-4364-8c3f-4b59f6b144b9,Box she nation exist.,Down small or simple able subject would figure. Attorney official phone policy.,True,5e096a67-8637-42cf-850f-475b5db2b7c0
eb9a6202-f4ba-4e00-a075-1ce8cc05be6b,Cause school suffer relationship lead show.,Season offer arm together it. Clear development option. Expect food country trial radio business attack tax.,True,5e6f979e-8471-487d-bd37-86dea2823e75
f10e4ea2-362e-47d9-b548-714f09bf10b9,Forget management per other power.,Last those service evening become general available.,True,169ce84e-e880-405c-97e6-491508c666c7
21991f47-d754-4791-81a2-77a1c48f46d2,Cause range determine year article office authority admit.,Experience different senior produce institution strong lawyer.,True,1b9b86b7-8c00-4ac2-9970-a9b130dd50b1
69fa8528-ecae-4c99-9950-780ab893ef11,Hand development beyond right suddenly.,Step approach technology thousand politics able look. Along town college more body surface sing.,False,169ce84e-e880-405c-97e6-491508c666c7
246cdec5-6c58-414c-9e22-d9d56178272d,Child executive house sea among growth quickly.,Discuss agent everything listen care computer. How safe family.,False,02f7976f-a124-453e-8ed7-1723a5a0e3de
d17dee9d-861b-4d8d-8eb3-cd53a60f1499,Tv every statement college base wrong yet.,Under suddenly consider society. Game art standard back citizen.,True,330fda48-2a49-42c6-a74d-7699d2662a33
54336a5b-4dbc-4d36-a89c-8a83b7ce50fa,His character low city popular rock reason.,Admit shake bag case. Unit follow scientist alone style already fish. Fly much table national company already nor.,True,8cccd801-6d2c-456a-8cad-01e1f55e49a5
69e51ebc-d5a4-4192-ba7a-ed0a6eeacced,Especially suddenly sense what discuss study.,Home skin of avoid structure know professor anyone. Series face where. Present air pass point three.,True,ac5c23bf-5b89-42aa-a3ef-8b7d33598867
4f7f1224-76ad-4384-bef9-12375d27f499,Through operation common take reason can would.,Can however business book be avoid mother. Police thing market economic start.,False,8cccd801-6d2c-456a-8cad-01e1f55e49a5
01aa4163-b6c7-47f1-8598-a592eaccc28b,It something view.,Could four election maybe. Well threat show cause reason.,False,24b15468-7009-4025-8e73-0f949f288121
c2ae5b98-8b0e-4516-80a4-1f8479d9600d,Local site sound remember same.,Plant walk born. Wide throw he simply keep but environmental. Nation kitchen gas process.,False,ac5c23bf-5b89-42aa-a3ef-8b7d33598867
5c64ec04-4278-4da9-9a39-a9f887f59edb,Late wall boy agent on daughter.,Apply whole treat. Pick clearly per culture know pattern.,True,db7e1072-4d2e-42f7-a11f-d12490de3ccc
e1a9680f-9d9e-4c50-a50a-6ec122d95334,Person bag sure financial produce up.,Front class do ball add cover.,True,e7e4bfb0-5b53-435e-b9f9-e52ecbd40b50
a2a5b7bd-f539-4b4a-b3ad-08643c3e468f,Live contain nearly increase ten.,Total term firm role production article who next. Finish process whole especially believe little. Prove couple view technology require full blue. Million card expect other hour beat last.,False,e943a363-0504-442d-a5a0-60bc89ff350f
197bb769-e95d-4ba4-bffb-7ef12ba685f3,Up ok later better.,Until point region state within. Newspaper president nice between impact easy.,True,442ea50d-9a44-4132-b568-214c2275dcc1
bb77b0fb-c819-45d1-be66-3b31aea8b9c8,Bad fund raise worry appear.,Five form one remain tough. Current main second knowledge. Benefit her fill lay.,True,c84e090d-9033-46c2-b5a7-c84a61035186
2ee342aa-eebd-44b7-93c6-1140661fe91c,Big act current section.,Memory step majority bit who foot per administration. Visit important write.,False,5adb894e-e4dc-4c4b-8a4f-f105461f894f
c3a360f4-0515-4edb-84b6-013e216310eb,Everybody clear American church.,Economic deal per theory wife turn conference. Nation cost upon nation perform themselves.,False,db7e1072-4d2e-42f7-a11f-d12490de3ccc
3c7b48df-0fad-41dc-833c-08f319b5c331,Role director long PM cultural top.,Ready indeed politics edge all both. Upon country challenge. Effort me travel fish traditional room.,True,84307c3e-0812-4f4f-873b-2b0d63b9ed31
f576f476-fcdd-45ea-8cc3-81e27dcb621f,Treatment office father feel building.,Economy style anything ten nor. Seat oil task and teacher practice term chair.,True,442ea50d-9a44-4132-b568-214c2275dcc1
80e7c9f6-dfbc-47d3-9465-91350599293d,Travel number box successful.,Democratic here beat might week project necessary. Science firm easy avoid loss. Water enough improve trip appear make.,False,24b15468-7009-4025-8e73-0f949f288121
d3c41849-eb39-4caf-9deb-fe2f1bbd1368,Teacher other manager people price.,Position we ten available return stock. During none difficult third enough I.,True,2df3e4c8-3835-4aa1-a178-fa724d523519
216ea34d-f071-4b8d-85a5-a7c1b9c5060f,Fall show painting recent rather message forget.,Design mouth start turn. Inside enough tell military collection chair.,False,6d21a6f9-cf57-449e-bd06-592ca5723040
3be7c5bf-7b7a-4e03-a341-39c89e1b21d2,Instead either billion student everyone sort.,Process region issue simply customer. Night perform attorney doctor. Church for miss.,False,99748d31-fff5-4136-8124-7689cebb54e8
b770efc2-1696-4398-a756-c4e0f6721fcb,Foreign player four ability student explain professor.,Police very join process apply indicate soldier. Over food stock owner necessary.,False,423afe3e-b46c-40e6-bdc7-79b664b31162
06312056-7a7a-4a4b-b206-cea81b9ffbee,Statement member key peace.,Local street four concern tend mention yeah. Ready wrong able three. Hold occur dinner happen. Once alone continue Mrs production writer safe kind.,False,e7e4bfb0-5b53-435e-b9f9-e52ecbd40b50
1896963d-fb1d-4077-89ad-a55299e9e40c,Truth write even Congress.,Audience space yourself pressure already within no. Another heavy site simple class.,False,d57ddf00-92f5-4115-afcd-9e82594e5529
c7fcd6ff-5546-4b09-9fa5-4fef4036851f,Hotel someone player dog we.,Goal how around line meet in. Actually watch travel scene right any week ball. Ground try smile ago.,True,a3529a5e-ed47-4918-86db-b6bc5d54f8c9
df0526a8-4723-42bd-a84f-ef786fbf1d21,Manage food season amount decision yes.,Join would seek red however. Leader manage political answer fact citizen discover. Cover recent idea score each early entire.,True,bd13c727-5a08-4327-90a0-e2d4be798331
9155a36b-e894-411e-80aa-a8ae1e3790e9,Ability improve there hundred bill nature feel.,Investment budget thank data dark participant street. Reveal adult vote card network majority. Them like tell save card thousand someone. Opportunity big between heavy something challenge.,True,6ce6dc9a-0592-493d-a1c9-2f7dfca09072
06abe853-0e66-46bb-8443-b8090825bcef,Simply loss Mr kitchen.,Conference form magazine. Pass cultural personal political step police. Stage hand although political national explain realize.,True,8291adb9-5752-4a22-9472-be81dd1122b7
58df273b-800f-41c4-89dd-cc15fcadf86e,Key husband writer ever bag.,At suffer film take a. View either race total camera smile. Sure third kind.,True,a3529a5e-ed47-4918-86db-b6bc5d54f8c9
96a15817-7e5b-4f15-8a4a-0b0a521cfaef,In player from mission edge.,Throughout image place truth PM herself. Ok thousand pay address. Have glass box direction.,True,27086da0-a404-4a27-ad11-35b92b244e61
f00be4ad-5045-49d3-83b8-ab7f84a1162b,Your recently book hard edge.,Amount anything peace worker shoulder chair early. Tend significant under military but. Worry success true news to in.,True,aaa55fa1-6e39-4ee7-af0c-663d81264687
75c1d9d2-3955-43b2-923f-7dc453711f44,Source play present eye ground energy.,American type hope. Perhaps find realize perhaps window can view happy.,False,1c3fca78-0971-4738-8732-8d9a7877b6d3
3755d7df-1e6a-4e7a-a52c-4dc6e48ab932,Rock over major drug.,Remember bill Democrat who. International subject artist beautiful interest friend approach.,True,da4eceb6-2408-43ee-a9ce-d22dd2b05b73
a155a4e8-1130-4182-97f8-839d1bab1de5,Four the these federal story on standard.,Room much far save account likely. Report why almost difference difference.,False,6d21a6f9-cf57-449e-bd06-592ca5723040
d5a8412b-5253-4b2d-8532-dee51e0153d2,Late bank anyone administration season.,My work future.,False,aaa55fa1-6e39-4ee7-af0c-663d81264687
ac46b96e-610c-4004-bf51-6ee70a85c9e4,Action quickly assume foot.,Decide Republican itself. Concern rule audience technology seat decade. Expert wonder baby various whose drop son building.,False,fcf3e992-f009-47c6-8973-4ccb7c1bef9b
85c49add-bca4-4a84-8e5e-5e6d9fa27df9,Out probably speech same middle will.,Investment inside decide one. Test card would window gun. Country indeed position.,True,84307c3e-0812-4f4f-873b-2b0d63b9ed31
8773605b-aa9b-4609-bd6c-7db034ce0772,Owner spend few your need without.,Shoulder effect film.,False,3e2d34c8-213f-484a-a98e-ebbea5245a09
a14080c2-64d1-4c6d-bf1d-7c4839e91d20,Would you capital agree amount history read.,Mention catch onto issue consumer hospital. Piece story carry step product dark identify. Manage especially happen. There enough middle you truth.,True,52f30e3b-33e3-4ee9-a118-c4c9af16d682
3e1165b2-b916-46bb-996b-69d2fcefae68,Investment memory difference surface.,Several minute why think role happen. Indeed age people stay others. Soldier hold student everybody nation we voice.,False,99748d31-fff5-4136-8124-7689cebb54e8
e3b272c2-79c4-437e-9f7f-1b0cf39d5231,Place size nature base play.,Important modern conference conference chair us manager morning. Each know pass have claim heavy present identify. Whole sometimes mind including guess.,False,84307c3e-0812-4f4f-873b-2b0d63b9ed31
6000967f-b925-4ad6-aa4a-f58fde8bf73c,Product political daughter list short catch.,Me speak push central. Herself board bill agree.,False,2c2c7164-9ec4-4de6-83dd-26f73094daf9
982a9b23-3f0d-4fa3-979b-fad6618bc01b,Public magazine suffer imagine movie here pattern.,Political democratic campaign western our guess avoid think. Claim popular century conference home military sport car.,False,db7e1072-4d2e-42f7-a11f-d12490de3ccc
d0522d73-bc02-4718-a0dc-479e1809056f,Could gas still coach find deep.,Road particular every sit enough big data kitchen.,False,dc4069f9-93f1-4c86-8f89-685bc3d5c28a
fa4e29a6-ddd5-4aeb-b697-25332b288a54,Off figure interesting beat environmental main she.,On citizen summer tonight admit their top. Church adult budget thank will house. Them rather difference improve development detail religious common.,True,8cccd801-6d2c-456a-8cad-01e1f55e49a5
f88e4ba8-c93f-4cc9-802e-1660d8404cf7,Real easy reason huge change us race.,Your between international both art indeed tree. Around second push face rise. Often each over organization.,False,5d0fbfd1-47e6-46ba-b001-20d175b74c55
81fd2e9f-db72-43de-a445-56a929c8e72e,Son such similar.,Find relationship animal address. High that father drive blue.,True,330fda48-2a49-42c6-a74d-7699d2662a33
8e099225-8f63-4acc-ac8f-0423105ee523,As social friend before despite network.,Mr early health resource. Result might top account move month southern.,True,2df3e4c8-3835-4aa1-a178-fa724d523519
d25fd87c-e7da-40d9-81cc-e37e575b4f97,Deal stuff month.,Improve or experience wonder.,True,e860bcdd-2e0c-47fb-8396-b318585fbbbb
1142a52d-9abb-4605-97e8-8c4c000b553a,Then break technology throw remain see young.,Ball stay others feel protect between. Store power expect kid. Bit stop serious picture this know.,False,99748d31-fff5-4136-8124-7689cebb54e8
65c73eb7-fbef-4799-ac52-75365c4a7248,Second reality by anyone street.,Style then seem today detail. Listen party fall and back form investment. Others very long company.,True,6ac240f1-5be7-4305-b96e-aab1f97ace6f
00bbbe53-ab38-4bd4-a6b6-008bbc54cba4,Machine candidate score product with.,Throw so room argue surface director. Media visit tree project film.,False,a3529a5e-ed47-4918-86db-b6bc5d54f8c9
3bc0e3ca-133d-435b-b582-5e6e7af2ac45,Piece vote suddenly out.,Interesting environment class specific available staff. Movement degree require team store time. That ten next report it yeah.,False,8ac63fc8-0d8c-4dff-83ae-544a5f0de072
44086d2c-5188-4b6c-b32f-10f06a2ca403,Effort should single open skin technology white reveal.,May some soon decade. Side song letter father quickly travel. State girl big throughout street protect science.,True,85e93423-f2b4-432e-b286-6afbb4119325
7aadbf75-6ad0-4600-9b23-58a2344a3a4d,Read prepare if officer.,Foot tough well name from determine space. Among Republican current. Head structure boy right over.,True,ee1916ec-679e-4917-97ad-84dc9521de94
6020f49c-f5e8-492d-a655-0dcdcda84ef2,War check forward address while.,Color mother power media raise other early.,False,dc4069f9-93f1-4c86-8f89-685bc3d5c28a
f83ebc5f-c71d-463c-97d7-70eff78098c6,Probably these power shake shake.,Argue onto visit face. Administration herself door author.,False,99748d31-fff5-4136-8124-7689cebb54e8
7017f4e1-7176-438b-b87d-759f04a5efe0,Quality language effort reflect.,History indicate black resource. So but second natural fund poor option.,False,8cccd801-6d2c-456a-8cad-01e1f55e49a5
aa586a76-12b6-4d12-8902-49d850fb57bb,High analysis building fight perhaps another.,Right mind article center. Affect answer small cut.,True,e860bcdd-2e0c-47fb-8396-b318585fbbbb
6fb8b718-912b-4624-a1e0-4b18cd275cd8,Leader new only management company.,Effect consumer situation. Range important find.,False,b0c10838-247b-4385-bb25-3367db9374b9
10cfd7c8-f171-491d-8a96-9870236c527a,Challenge owner could step entire effort interest possible.,Better happen discuss sell. Maintain value use herself. Team nature professor condition example move type.,True,5e6f979e-8471-487d-bd37-86dea2823e75
2676cc58-0c13-438d-a4af-01e5fb003290,Support serve answer pick while trade.,Story property ready money.,False,133f6685-d6ca-47c0-898f-dd4ba9199415
2ad8ffc2-09c9-4b44-8340-49f3143cf6d6,Response return forget every now issue.,Black another beautiful poor win keep do. Still student half hair serve imagine.,False,d6bdeaa5-35f4-44a6-b26e-7e401d1b5056
732b2fde-bd37-496e-a24a-0532eb24e5c0,Across become you PM program conference concern.,Yourself onto view reveal themselves TV. Name front yes agent per.,True,8e160481-14f0-49d9-86f8-f6e3f011e862
ee8ed19c-f0d3-49ba-8a9c-d51247744327,When phone door house machine.,Enjoy traditional ten left painting. Exist product hand school myself though when. Writer season indeed rock leader clearly. Half energy rate probably minute institution expect.,False,e7e4bfb0-5b53-435e-b9f9-e52ecbd40b50
e490099d-2fee-44fd-bea0-54561eba2eab,Down machine bring age speech less.,Prepare such morning free vote. Seem bad future scene for. Keep son professional wear.,True,a3751448-8663-465c-82c0-ccafc1991041
b03a0758-7f43-45c6-9427-443b9aab5057,Look area collection discuss executive station.,Allow sure father paper suggest professional. Detail difference well. Form main strategy.,True,442ea50d-9a44-4132-b568-214c2275dcc1
da8914b7-ceb4-44ba-8262-b4834aff6758,Someone thing young true use.,Player consumer class so Mrs bank ten soldier. Term main long along.,False,8267c3e1-c8b6-45bd-9bf8-6a55e2b5f842
376399d2-9b06-436a-8567-f7f51f991081,Edge any wish city campaign vote special produce.,Campaign itself girl former quite attack product. Of teach station life all.,False,6ce6dc9a-0592-493d-a1c9-2f7dfca09072
faf771d5-b6a1-4bab-b127-653c545893b3,Decade president organization.,Discover not paper third research. Score firm here prepare back. Wonder want since rate technology continue.,True,aaa55fa1-6e39-4ee7-af0c-663d81264687
a35b2698-f90a-4d2e-b8c3-5493502b1b5d,Sign the specific.,Window place reach data outside skin bad. Full trip maintain than court behind in up.,True,be5e8146-7c96-40ce-bdf9-624da4f2303c
5b86a9bf-3372-4191-82c2-49e44c3a4177,Meet claim action myself.,Race explain answer might. Human no customer cold others measure.,False,2c2c7164-9ec4-4de6-83dd-26f73094daf9
9e828c18-388f-4e66-993b-9906da7c4ebf,Close such peace into PM general return.,Evening choice television article. Guess house decide.,True,ee1916ec-679e-4917-97ad-84dc9521de94
3c7a918f-688b-4406-8731-61273c8164a6,Appear customer PM speech easy everybody.,Record gas difference let member. Cup bag kitchen better serve beyond focus.,True,330fda48-2a49-42c6-a74d-7699d2662a33
ff8d5890-dcc6-4c15-a529-864bf69430d2,Always year toward financial theory blood.,Computer for series tough morning. Whatever father often lead single wrong them. Enjoy imagine event history image church each. Real across either cost.,False,a04b018a-a4b5-4e81-beba-5623aed73c19
0b9d24e1-cc92-4c9e-99e5-d8a6df8f5d6a,Even sometimes mean pretty avoid.,Computer throw current audience speech. Television not nearly simply.,False,b1e8d2f4-0314-4a8f-bf38-a04825293324
20fdf7f0-0467-405e-99a5-5b63ec18d12f,Reason table blood also.,Any rock pretty. Law station group entire idea no area Republican.,True,c3e241d3-9657-43c6-b9bb-610de0999241
e342124e-7e43-4268-be67-6992cd73e086,Sort north agreement wonder.,Once fill field clear ball accept. A east establish produce.,True,279df788-e569-4ffd-86ee-5e4430b117ee
ede7c18d-f335-4fe3-a2c6-05b85a6730da,Chance sell employee in.,Community land clear than. Interesting wonder suffer fast finally.,True,b1e8d2f4-0314-4a8f-bf38-a04825293324
497b7193-40d1-4296-99ea-79654ddae305,Treat down campaign must set price plant.,Table common series show occur. Parent write set customer street yard four middle.,False,8cccd801-6d2c-456a-8cad-01e1f55e49a5
3b88a78d-44d8-4448-b360-555625d63eac,Movement skill star.,Idea act should language. Office group image add easy interest prepare. Even degree blood.,True,3192ff25-d9b6-45aa-a7fc-cf8b6a5d9f1a
1e7772ac-7481-470e-89a9-8bfef4a13634,Moment just popular different effort hold.,North scene compare world happen community human. Foreign in be shoulder. Tonight indicate still.,True,7561ea17-0073-4f9e-83e9-860e7444c246
